<map version="freeplane 1.9.13">
<!--To view this file, download free mind mapping software Freeplane from https://www.freeplane.org -->
<attribute_registry SHOW_ATTRIBUTES="selected"/>
<node TEXT="Tutorial -o- Matic" LOCALIZED_STYLE_REF="AutomaticLayout.level.root" FOLDED="false" ID="ID_1356277378" LINK="file:/C:/Respaldo%20EF/ef/Documentos%20con%20macros/08%20Freemind%20Groovy/scripts/ScriptsEnComputadorYDesarrollosEdo%20v1.9.mm" MAX_WIDTH="5.5 cm"><hook NAME="MapStyle" background="#f9f9f8" zoom="0.8">
    <conditional_styles>
        <conditional_style ACTIVE="true" STYLE_REF="file" LAST="false">
            <script_condition>
                <script>{node.link?.uri?.scheme == &apos;file&apos;}</script>
            </script_condition>
        </conditional_style>
        <conditional_style ACTIVE="true" STYLE_REF="modifiedFile" LAST="false">
            <attribute_contains_condition ATTRIBUTE="modifiedFile" VALUE="true"/>
        </conditional_style>
        <conditional_style ACTIVE="true" STYLE_REF="file_folder" LAST="false">
            <script_condition>
                <script>{node.link?.uri?.scheme == &apos;file&apos; &amp;&amp; (node.link.file?.exists()? node.link.file.directory : node.link.uri.path?.reverse()[0] == &apos;/&apos;)}</script>
            </script_condition>
        </conditional_style>
        <conditional_style ACTIVE="true" STYLE_REF="file_folder_with_icon" LAST="false">
            <conjunct_condition>
                <style_contains_condition TEXT="file_folder"/>
                <script_condition>
                    <script>import org.freeplane.core.util.FreeplaneVersion&#xd;
return (c.freeplaneVersion &lt; FreeplaneVersion.getVersion(&quot;1.9.0&quot;) || !(node.link?.uri?.scheme == &apos;file&apos;) )</script>
                </script_condition>
            </conjunct_condition>
        </conditional_style>
        <conditional_style ACTIVE="true" STYLE_REF="Warning" LAST="false">
            <node_contains_condition VALUE=".EXIT_ON_CLOSE" ITEM="filter_any_text"/>
        </conditional_style>
        <conditional_style ACTIVE="false" STYLE_REF="BotonMenu" LAST="false">
            <hyper_link_contains TEXT="menuitem:"/>
        </conditional_style>
        <conditional_style ACTIVE="true" STYLE_REF="menuButton" LAST="false">
            <hyper_link_contains TEXT="menuitem:"/>
        </conditional_style>
        <conditional_style ACTIVE="false" STYLE_REF="Siguiente tarea" LAST="false">
            <script_condition>
                <script>node.children.any{it.style.name == &apos;Siguiente tarea&apos;}</script>
            </script_condition>
        </conditional_style>
        <conditional_style ACTIVE="false" STYLE_REF="nextTask" LAST="false">
            <script_condition>
                <script>node.children.any{it.style.name == &apos;nextTask&apos;}</script>
            </script_condition>
        </conditional_style>
        <conditional_style ACTIVE="true" STYLE_REF="GroovyNode" LAST="false">
            <script_condition>
                <script>try { edofro.freeplane.groovynode.GN.isGroovyNode(node) } catch(e) { false }</script>
            </script_condition>
        </conditional_style>
        <conditional_style ACTIVE="true" STYLE_REF="hasGroovyNode" LAST="false">
            <script_condition>
                <script>(node.findAll() - node).any{
    edofro.freeplane.groovynode.GN.isGroovyNode(it)
}</script>
            </script_condition>
        </conditional_style>
        <conditional_style ACTIVE="true" STYLE_REF="containsNextTasks" LAST="true">
            <script_condition>
                <script>(node.findAll() - node)?.any{it.style.name == &apos;nextTask&apos;}</script>
            </script_condition>
        </conditional_style>
        <conditional_style ACTIVE="false" STYLE_REF="containsNextTasks" LAST="true">
            <script_condition>
                <script>(node.findAll() - node)?.any{it.style.name == &apos;Siguiente tarea&apos;} </script>
            </script_condition>
        </conditional_style>
        <conditional_style ACTIVE="false" STYLE_REF="contieneSigTareas" LAST="true">
            <script_condition>
                <script>(node.findAll() - node)?.any{it.style.name == &apos;Siguiente tarea&apos;} </script>
            </script_condition>
        </conditional_style>
        <conditional_style ACTIVE="true" STYLE_REF="containsPendingTasks" LAST="true">
            <script_condition>
                <script>(node.findAll() - node)?.any{it.style.name == &apos;pendingTask&apos;}</script>
            </script_condition>
        </conditional_style>
        <conditional_style ACTIVE="false" STYLE_REF="containsPendingTasks" LAST="true">
            <script_condition>
                <script>(node.findAll() - node)?.any{it.style.name == &apos;Tarea pendiente&apos;} </script>
            </script_condition>
        </conditional_style>
        <conditional_style ACTIVE="false" STYLE_REF="contieneTareaPend" LAST="true">
            <script_condition>
                <script>(node.findAll() - node)?.any{it.style.name == &apos;Tarea pendiente&apos;} </script>
            </script_condition>
        </conditional_style>
        <conditional_style ACTIVE="true" STYLE_REF="customMenuPackage" LAST="false">
            <attribute_exists_condition ATTRIBUTE="tbActions"/>
        </conditional_style>
        <conditional_style ACTIVE="false" STYLE_REF="file_folder_with_icon" LAST="false">
            <conjunct_condition>
                <script_condition>
                    <script>import org.freeplane.core.util.FreeplaneVersion&#xd;
return (c.freeplaneVersion &lt; FreeplaneVersion.getVersion(&quot;1.9.0&quot;) || !(node.link?.uri?.scheme == &apos;file&apos;) )</script>
                </script_condition>
                <style_equals_condition TEXT="file_folder"/>
            </conjunct_condition>
        </conditional_style>
    </conditional_styles>
    <properties edgeColorConfiguration="#808080ff,#ff0000ff,#0000ffff,#00ff00ff,#ff00ffff,#00ffffff,#7c0000ff,#00007cff,#007c00ff,#7c007cff,#007c7cff,#7c7c00ff" mapUsesOwnSaveOptions="true" BookmarksKeys="{}" followedTemplateLocation="file:/C:/Users/Edo/AppData/Roaming/Freeplane/1.9.x/templates/DFGHI%20Proyecto-Groovy-Tareas-MDI-menuButton%20(vis01).mm" pruebaDiccionario="ID_311366985|:|idDictionary|-|ID_323296041|:|ToM Actions|-|" show_icon_for_attributes="true" show_notes_in_map="false" save_modification_times="false" save_last_visited_node="default" show_note_icons="true" mdhFreeMindmapPath="hhgf" save_folding="save_folding_if_map_is_changed" followedMapLastTime="1634692874154" fit_to_viewport="false"/>

<map_styles>
<stylenode LOCALIZED_TEXT="styles.root_node" ID="ID_118736178" STYLE="oval" UNIFORM_SHAPE="true" VGAP_QUANTITY="24 pt">
<font SIZE="24"/>
<stylenode LOCALIZED_TEXT="styles.predefined" POSITION="right" STYLE="bubble">
<stylenode LOCALIZED_TEXT="default" ID="ID_506805493" ICON_SIZE="12 pt" FORMAT_AS_HYPERLINK="false" COLOR="#484747" BACKGROUND_COLOR="#efefef" STYLE="bubble" SHAPE_HORIZONTAL_MARGIN="5 px" SHAPE_VERTICAL_MARGIN="2 px" NUMBERED="false" FORMAT="STANDARD_FORMAT" TEXT_ALIGN="DEFAULT" BORDER_WIDTH_LIKE_EDGE="false" BORDER_WIDTH="1.9 px" BORDER_COLOR_LIKE_EDGE="false" BORDER_COLOR="#8fbcbb" BORDER_DASH_LIKE_EDGE="true" BORDER_DASH="SOLID" VGAP_QUANTITY="2 px" MAX_WIDTH="10 cm" MIN_WIDTH="0 cm">
<arrowlink SHAPE="CUBIC_CURVE" COLOR="#bf5d3f" WIDTH="2" TRANSPARENCY="200" DASH="" FONT_SIZE="9" FONT_FAMILY="SansSerif" DESTINATION="ID_506805493" STARTINCLINATION="45.19149 pt;-2.29787 pt;" ENDINCLINATION="56.68085 pt;29.87234 pt;" STARTARROW="NONE" ENDARROW="DEFAULT"/>
<font NAME="Dialog" SIZE="10" BOLD="false" STRIKETHROUGH="false" ITALIC="false"/>
<edge STYLE="horizontal" COLOR="#2e3440" WIDTH="1" DASH="SOLID"/>
<richcontent CONTENT-TYPE="plain/auto" TYPE="DETAILS"/>
<richcontent TYPE="NOTE" CONTENT-TYPE="plain/auto"/>
</stylenode>
<stylenode LOCALIZED_TEXT="defaultstyle.details" ID="ID_861824498" COLOR="#006666" BACKGROUND_COLOR="#a5cece" BACKGROUND_ALPHA="204" BORDER_WIDTH_LIKE_EDGE="false" BORDER_WIDTH="1.9 px" BORDER_COLOR_LIKE_EDGE="false" BORDER_COLOR="#f0f0f0" BORDER_DASH_LIKE_EDGE="true">
<font NAME="Lucida Sans" SIZE="8"/>
</stylenode>
<stylenode LOCALIZED_TEXT="defaultstyle.attributes" ID="ID_199621123">
<font NAME="Lucida Sans" SIZE="8"/>
</stylenode>
<stylenode LOCALIZED_TEXT="defaultstyle.note" ID="ID_810825098" COLOR="#004600" BACKGROUND_COLOR="#e8e8c8" TEXT_ALIGN="LEFT">
<icon BUILTIN="clock2"/>
<font NAME="Consolas" SIZE="10"/>
</stylenode>
<stylenode LOCALIZED_TEXT="defaultstyle.floating" ID="ID_608497754">
<edge STYLE="hide_edge"/>
<cloud COLOR="#f0f0f0" SHAPE="ROUND_RECT"/>
</stylenode>
<stylenode LOCALIZED_TEXT="defaultstyle.selection" COLOR="#eceff4" BACKGROUND_COLOR="#bf616a" BORDER_COLOR_LIKE_EDGE="false" BORDER_COLOR="#bf616a"/>
</stylenode>
<stylenode LOCALIZED_TEXT="styles.user-defined" POSITION="right" STYLE="bubble">
<stylenode LOCALIZED_TEXT="styles.important" ID="ID_915433779" BORDER_COLOR="#bf616a">
<icon BUILTIN="yes"/>
<arrowlink COLOR="#bf616a" TRANSPARENCY="255" DESTINATION="ID_915433779"/>
<font NAME="Ubuntu" SIZE="14"/>
<edge COLOR="#bf616a"/>
</stylenode>
<stylenode TEXT="baseFolder" ID="ID_1803757085" ICON_SIZE="20 pt" BACKGROUND_COLOR="#ffeca9">
<icon BUILTIN="emoji-1F4BD"/>
<font BOLD="true"/>
</stylenode>
<stylenode TEXT="newFolderImport" ID="ID_1891404637" ICON_SIZE="16 pt" BACKGROUND_COLOR="#ffeca9">
<icon BUILTIN="emoji-1F4BE"/>
<font BOLD="true"/>
</stylenode>
<stylenode TEXT="freshNew" ID="ID_1333755930" ICON_SIZE="16 pt" BACKGROUND_COLOR="#ace500">
<icon BUILTIN="emoji-1F195"/>
</stylenode>
<stylenode TEXT="movedRenamed" ID="ID_152421968" ICON_SIZE="16 pt" BACKGROUND_COLOR="#ace500">
<icon BUILTIN="emoji-1F500"/>
</stylenode>
<stylenode TEXT="file" ID="ID_1056721864" BORDER_WIDTH="2.5 px" BACKGROUND_COLOR="#bcc6e0" FORMAT="NO_FORMAT">
<font NAME="Consolas"/>
</stylenode>
<stylenode TEXT="file_folder" ID="ID_974414569" BORDER_WIDTH="3 px"/>
<stylenode TEXT="missing" ID="ID_340464737" BACKGROUND_COLOR="#f28bb3" BORDER_WIDTH="3 px">
<icon BUILTIN="broken-line"/>
</stylenode>
<stylenode TEXT="modifiedFile" ID="ID_386547706" BACKGROUND_COLOR="#ffcc00" BORDER_WIDTH="4 px" BORDER_COLOR_LIKE_EDGE="false" BORDER_COLOR="#00659b">
<icon BUILTIN="emoji-002A-20E3"/>
<font ITALIC="true"/>
</stylenode>
<stylenode TEXT="locked" ID="ID_1276559700" COLOR="#e1e1e1" BACKGROUND_COLOR="#6f4e4e" BORDER_WIDTH="2.5 px">
<icon BUILTIN="emoji-1F512"/>
</stylenode>
<stylenode TEXT="file_folder_with_icon" ID="ID_1530415124">
<icon BUILTIN="emoji-1F4C2"/>
</stylenode>
<stylenode TEXT="GroovyNode" ID="ID_390969093" ICON_SIZE="16 pt" COLOR="#286b86" BACKGROUND_COLOR="#92c5d7" STYLE="bubble" BORDER_COLOR_LIKE_EDGE="false" BORDER_COLOR="#286b86">
<icon BUILTIN="groovyNode/groovy-G"/>
<font NAME="Harlow Solid Italic" SIZE="12"/>
</stylenode>
<stylenode TEXT="Warning" ID="ID_151447265" BACKGROUND_COLOR="#f28bb3" BORDER_WIDTH="6 px" BORDER_COLOR_LIKE_EDGE="false" BORDER_COLOR="#990000">
<icon BUILTIN="closed"/>
</stylenode>
<stylenode TEXT="hasGroovyNode" ID="ID_430505112">
<icon BUILTIN="groovyNode/groovy-G"/>
</stylenode>
<stylenode LOCALIZED_TEXT="styles.topic" ID="ID_772533012" COLOR="#18898b" STYLE="fork">
<font NAME="Liberation Sans" SIZE="10" BOLD="true"/>
</stylenode>
<stylenode LOCALIZED_TEXT="styles.subtopic" ID="ID_53045809" COLOR="#cc3300" STYLE="fork">
<font NAME="Liberation Sans" SIZE="10" BOLD="true"/>
</stylenode>
<stylenode LOCALIZED_TEXT="styles.subsubtopic" ID="ID_1313723148" COLOR="#669900">
<font NAME="Liberation Sans" SIZE="10" BOLD="true"/>
</stylenode>
<stylenode TEXT="Siguiente tarea" ID="ID_975465148" BACKGROUND_COLOR="#ffff33">
<icon BUILTIN="yes"/>
<icon BUILTIN="unchecked"/>
<font NAME="MV Boli"/>
</stylenode>
<stylenode TEXT="nextTask" ID="ID_542130416" BACKGROUND_COLOR="#ffff33">
<icon BUILTIN="yes"/>
<icon BUILTIN="unchecked"/>
</stylenode>
<stylenode TEXT="Tarea pendiente" ID="ID_113937740" BACKGROUND_COLOR="#99ffff">
<icon BUILTIN="unchecked"/>
<font NAME="MV Boli"/>
</stylenode>
<stylenode TEXT="pendingTask" ID="ID_968429526" BACKGROUND_COLOR="#99ffff">
<icon BUILTIN="unchecked"/>
</stylenode>
<stylenode TEXT="Tarea finalizada" ID="ID_761736598" COLOR="#333333" BACKGROUND_COLOR="#cccccc">
<icon BUILTIN="checked"/>
<font NAME="MV Boli" ITALIC="true"/>
</stylenode>
<stylenode TEXT="completedTask" ID="ID_896009247" COLOR="#333333" BACKGROUND_COLOR="#cccccc">
<icon BUILTIN="checked"/>
<font ITALIC="true"/>
</stylenode>
<stylenode TEXT="Tarea Descartada" ID="ID_786208026" COLOR="#666666" BACKGROUND_COLOR="#cccccc">
<icon BUILTIN="Descartado"/>
<font NAME="MV Boli" ITALIC="true"/>
</stylenode>
<stylenode TEXT="discardedTask" ID="ID_73139650" COLOR="#666666" BACKGROUND_COLOR="#cccccc">
<icon BUILTIN="Descartado"/>
<font ITALIC="true"/>
</stylenode>
<stylenode TEXT="contieneSigTareas" ID="ID_1485847107" BACKGROUND_COLOR="#eaea86">
<icon BUILTIN="emoji-1F7E5"/>
<font NAME="MV Boli"/>
</stylenode>
<stylenode TEXT="containsNextTasks" ID="ID_51976239" BACKGROUND_COLOR="#eaea86">
<icon BUILTIN="emoji-1F7E5"/>
</stylenode>
<stylenode TEXT="contieneTareaPend" ID="ID_1336123578" BACKGROUND_COLOR="#b5d7d7">
<icon BUILTIN="emoji-23F9"/>
<font NAME="MV Boli"/>
</stylenode>
<stylenode TEXT="containsPendingTasks" ID="ID_400770977" BACKGROUND_COLOR="#b5d7d7">
<icon BUILTIN="emoji-23F9"/>
</stylenode>
<stylenode TEXT="Proyecto" ID="ID_375411389" COLOR="#003399">
<font NAME="SansSerif" SIZE="12" BOLD="true" ITALIC="false"/>
<edge COLOR="#003399" WIDTH="6"/>
</stylenode>
<stylenode TEXT="Grupito" ID="ID_1846275050">
<cloud COLOR="#e4e6ff" SHAPE="ROUND_RECT"/>
</stylenode>
<stylenode TEXT="Iniciativa" ID="ID_1412484620">
<icon BUILTIN="attach"/>
<font BOLD="true"/>
</stylenode>
<stylenode TEXT="Organizador" ID="ID_925943476">
<icon BUILTIN="folder"/>
<font BOLD="true"/>
</stylenode>
<stylenode TEXT="Minuta" ID="ID_1804751247">
<icon BUILTIN="list"/>
<cloud COLOR="#69a1f8" SHAPE="ROUND_RECT"/>
</stylenode>
<stylenode TEXT="Acuerdo" ID="ID_1723187143" BACKGROUND_COLOR="#66ff33">
<icon BUILTIN="flag-black"/>
</stylenode>
<stylenode TEXT="numerado" ID="ID_275647364" BACKGROUND_COLOR="#add1ea" STYLE="bubble" NUMBERED="true" MAX_WIDTH="200 px" MIN_WIDTH="200 px"/>
<stylenode TEXT="con duda" ID="ID_87204236" BACKGROUND_COLOR="#ffff66">
<icon BUILTIN="help"/>
<font BOLD="false" ITALIC="true"/>
</stylenode>
<stylenode TEXT="BotonMenu" ID="ID_973394045" ICON_SIZE="16 pt" COLOR="#b2dfff" BACKGROUND_COLOR="#3f657f" STYLE="bubble" BORDER_WIDTH="3 px" BORDER_COLOR_LIKE_EDGE="false" BORDER_COLOR="#0097ff"/>
<stylenode TEXT="menuButton" ID="ID_585316311" COLOR="#b2dfff" BACKGROUND_COLOR="#3f657f" STYLE="bubble" BORDER_WIDTH="3 px" BORDER_COLOR_LIKE_EDGE="false" BORDER_COLOR="#0097ff"/>
<stylenode TEXT="project" ID="ID_401996053" COLOR="#e1e19c" BACKGROUND_COLOR="#1c1c63">
<icon BUILTIN="emoji-1F5C2"/>
<attribute NAME="projectCode" VALUE=""/>
</stylenode>
<stylenode TEXT="MarkdownHelperNode" ID="ID_1601600239" COLOR="#dbffdb" BACKGROUND_COLOR="#333333" STYLE="rectangle" BORDER_WIDTH="4 px" BORDER_COLOR_LIKE_EDGE="false" BORDER_COLOR="#009000">
<icon BUILTIN="emoji-1F343"/>
<richcontent TYPE="NOTE" CONTENT-TYPE="plain/markdown"/>
</stylenode>
<stylenode TEXT="customMenuPackage" ID="ID_113647305" ICON_SIZE="20 pt" STYLE="rectangle" SHAPE_HORIZONTAL_MARGIN="5 px" SHAPE_VERTICAL_MARGIN="2 px" BORDER_WIDTH="3 px" BORDER_COLOR="#ae5528">
<icon BUILTIN="emoji-1F4E6"/>
<font BOLD="true" ITALIC="true"/>
</stylenode>
<stylenode TEXT="tasksBucket">
<icon BUILTIN="emoji-1F5C3"/>
<font BOLD="true"/>
</stylenode>
<stylenode TEXT="maybeTask" BACKGROUND_COLOR="#cefcfc">
<icon BUILTIN="emoji-23FA"/>
</stylenode>
<stylenode TEXT="milestone" ID="ID_1871867242" FORMAT="markdownPatternFormat">
<icon BUILTIN="emoji-1F6A9"/>
<font BOLD="true"/>
</stylenode>
</stylenode>
<stylenode LOCALIZED_TEXT="styles.AutomaticLayout" POSITION="right" STYLE="bubble">
<stylenode LOCALIZED_TEXT="AutomaticLayout.level.root" ID="ID_1209359852" COLOR="#ffffff" BACKGROUND_COLOR="#484747" STYLE="bubble" SHAPE_HORIZONTAL_MARGIN="10 pt" SHAPE_VERTICAL_MARGIN="15 pt" TEXT_ALIGN="CENTER" MAX_WIDTH="5 cm" MIN_WIDTH="3 cm">
<font SIZE="18"/>
</stylenode>
<stylenode LOCALIZED_TEXT="AutomaticLayout.level,1" ID="ID_144205114" COLOR="#eceff4" BACKGROUND_COLOR="#d08770" STYLE="bubble" SHAPE_HORIZONTAL_MARGIN="8 pt" SHAPE_VERTICAL_MARGIN="5 pt">
<font SIZE="16"/>
</stylenode>
<stylenode LOCALIZED_TEXT="AutomaticLayout.level,2" ID="ID_159773648" COLOR="#3b4252" BACKGROUND_COLOR="#ebcb8b">
<font SIZE="14"/>
</stylenode>
<stylenode LOCALIZED_TEXT="AutomaticLayout.level,3" COLOR="#2e3440" BACKGROUND_COLOR="#a3be8c">
<font SIZE="12"/>
</stylenode>
<stylenode LOCALIZED_TEXT="AutomaticLayout.level,4" COLOR="#2e3440" BACKGROUND_COLOR="#b48ead">
<font SIZE="11"/>
</stylenode>
<stylenode LOCALIZED_TEXT="AutomaticLayout.level,5" COLOR="#e5e9f0" BACKGROUND_COLOR="#5e81ac">
<font SIZE="11"/>
</stylenode>
<stylenode LOCALIZED_TEXT="AutomaticLayout.level,6" BACKGROUND_COLOR="#81a1c1">
<font SIZE="10"/>
</stylenode>
<stylenode LOCALIZED_TEXT="AutomaticLayout.level,7" BACKGROUND_COLOR="#88c0d0">
<font SIZE="10"/>
</stylenode>
<stylenode LOCALIZED_TEXT="AutomaticLayout.level,8" BACKGROUND_COLOR="#8fbcbb">
<font SIZE="10"/>
</stylenode>
<stylenode LOCALIZED_TEXT="AutomaticLayout.level,9" BACKGROUND_COLOR="#d8dee9">
<font SIZE="10"/>
</stylenode>
<stylenode LOCALIZED_TEXT="AutomaticLayout.level,10" BACKGROUND_COLOR="#e5e9f0">
<font SIZE="9"/>
</stylenode>
</stylenode>
</stylenode>
</map_styles>
</hook>
<node TEXT="Freeplane_Tutorial_AddOn" STYLE_REF="baseFolder" POSITION="right" ID="ID_1318548517" LINK="file:/C:/Users/Edo/Documents/GitHub/Freeplane_Tutorial_AddOn/" VGAP_QUANTITY="2 px">
<icon BUILTIN="emoji-1F4B2"/>
<attribute NAME="nameFilter" VALUE=""/>
<attribute NAME="maxDepth" VALUE="-1" OBJECT="org.freeplane.features.format.FormattedNumber|-1|#0.####"/>
<attribute NAME="markWhenMoved" VALUE="0" OBJECT="org.freeplane.features.format.FormattedNumber|0|#0.####"/>
<attribute NAME="checkIfReallyBroken" VALUE="0" OBJECT="org.freeplane.features.format.FormattedNumber|0|#0.####"/>
<attribute NAME="lastModifiedTime" VALUE="24-12-21 11:45" OBJECT="org.freeplane.features.format.FormattedDate|2021-12-24T11:45-0300|dd-MM-yy HH:mm"/>
<attribute NAME="lastAccessTime" VALUE="02-03-22 19:06" OBJECT="org.freeplane.features.format.FormattedDate|2022-03-02T19:06-0300|dd-MM-yy HH:mm"/>
<attribute NAME="creationTime" VALUE="12-09-21 15:08" OBJECT="org.freeplane.features.format.FormattedDate|2021-09-12T15:08-0300|datetime"/>
<attribute NAME="fileSize" VALUE="4.096" OBJECT="org.freeplane.features.format.FormattedNumber|4096|#,##0"/>
<richcontent TYPE="NOTE" CONTENT-TYPE="xml/">
<html>
  <head>
    
  </head>
  <body>
    <p>
      null
    </p>
    <p>
      
    </p>
    <p>
      ================ MDI =====================
    </p>
    <p>
      
    </p>
    <p>
      The import of files and folders can be adapted by providing various options in the attributes of the BaseFolder node:
    </p>
    <p>
      
    </p>
    <p>
      -----------------------------------------------------
    </p>
    <p>
      &nbsp;&nbsp;&nbsp;&nbsp;-- nameFilter:
    </p>
    <p>
      -----------------------------------------------------
    </p>
    <p>
      &nbsp;&nbsp;&nbsp;&nbsp;&nbsp;&nbsp;&nbsp;A filter to perform on the name of traversed files. If set, only files which match are brought.
    </p>
    <p>
      &nbsp;&nbsp;&nbsp;&nbsp;&nbsp;&nbsp;&nbsp;&nbsp;This option allowes four types of inputs:
    </p>
    <p>
      &nbsp;&nbsp;&nbsp;&nbsp;&nbsp;&nbsp;&nbsp;&nbsp;&nbsp;&nbsp;&nbsp;1. nothing (empty) means no filtering (default)
    </p>
    <p>
      &nbsp;&nbsp;&nbsp;&nbsp;&nbsp;&nbsp;&nbsp;&nbsp;&nbsp;&nbsp;&nbsp;2. regex&nbsp;&nbsp;&nbsp;&nbsp;&nbsp;&nbsp;&nbsp;&nbsp;&nbsp;&nbsp;&nbsp;&nbsp;&nbsp;&nbsp;&nbsp;&nbsp;&nbsp;&nbsp;&nbsp;- example:&nbsp;&nbsp;&nbsp;&nbsp;&nbsp;&nbsp;&nbsp;~/.*\.mp3/
    </p>
    <p>
      &nbsp;&nbsp;&nbsp;&nbsp;&nbsp;&nbsp;&nbsp;&nbsp;&nbsp;&nbsp;&nbsp;3. 'simplified' regex&nbsp;&nbsp;&nbsp;&nbsp;- example:&nbsp;&nbsp;&nbsp;&nbsp;&nbsp;&nbsp;&nbsp;~.*\.mp3
    </p>
    <p>
      &nbsp;&nbsp;&nbsp;&nbsp;&nbsp;&nbsp;&nbsp;&nbsp;&nbsp;&nbsp;&nbsp;4. string with *&nbsp;&nbsp;&nbsp;&nbsp;&nbsp;&nbsp;&nbsp;&nbsp;&nbsp;&nbsp;- example:&nbsp;&nbsp;&nbsp;&nbsp;&nbsp;&nbsp;&nbsp;*.mp3&nbsp;&nbsp;&nbsp;&nbsp;(equivalent to regex&nbsp;&nbsp;&nbsp;&nbsp;&nbsp;&nbsp;~/(?i).*\.mp3/&nbsp;&nbsp;)
    </p>
    <p>
      &nbsp;&nbsp;&nbsp;&nbsp;&nbsp;&nbsp;&nbsp;&nbsp;&nbsp;&nbsp;&nbsp;5. list of strings with * and ;&nbsp;&nbsp;&nbsp;&nbsp;&nbsp;&nbsp;&nbsp;&nbsp;&nbsp;- example:&nbsp;&nbsp;&nbsp;&nbsp;&nbsp;&nbsp;&nbsp;*.mp3;*.png&nbsp;&nbsp;&nbsp;(equivalent to regex&nbsp;&nbsp;&nbsp;&nbsp;&nbsp;&nbsp;~/(?i)(.*\.mp3|.*\.png)/&nbsp;&nbsp;)
    </p>
    <p>
      
    </p>
    <p>
      -----------------------------------------------------
    </p>
    <p>
      &nbsp;&nbsp;-- maxDepth:
    </p>
    <p>
      -----------------------------------------------------
    </p>
    <p>
      &nbsp;&nbsp;&nbsp;&nbsp;&nbsp;&nbsp;&nbsp;The maximum number of directory levels when recursing
    </p>
    <p>
      &nbsp;&nbsp;&nbsp;&nbsp;&nbsp;&nbsp;&nbsp;&nbsp;(default is -1 which means no limit, set to 0 for no recursion)
    </p>
    <p>
      
    </p>
    <p>
      
    </p>
    <p>
      
    </p>
    <p>
      -----------------------------------------------------
    </p>
    <p>
      &nbsp;&nbsp;-- markWhenMoved:
    </p>
    <p>
      -----------------------------------------------------
    </p>
    <p>
      &nbsp;&nbsp;&nbsp;&nbsp;&nbsp;&nbsp;&nbsp;change styles to moved/renamed file Nodes
    </p>
    <p>
      
    </p>
    <p>
      &nbsp;set to:
    </p>
    <p>
      &nbsp;&nbsp;&nbsp;&nbsp;0 : to change style only if node hasn't a previous one (default),
    </p>
    <p>
      
    </p>
    <p>
      &nbsp;&nbsp;&nbsp;&nbsp;1 : to allways change the style,
    </p>
    <p>
      
    </p>
    <p>
      &nbsp;&nbsp;&nbsp;-1 : to never change the style
    </p>
    <p>
      
    </p>
    <p>
      &nbsp;&nbsp;&nbsp;
    </p>
    <p>
      
    </p>
    <p>
      -----------------------------------------------------
    </p>
    <p>
      &nbsp;&nbsp;-- checkIfReallyBroken:
    </p>
    <p>
      -----------------------------------------------------
    </p>
    <p>
      &nbsp;&nbsp;&nbsp;&nbsp;&nbsp;&nbsp;&nbsp;Check if existing nodes pointing to filtered files still exist.&nbsp;
    </p>
    <p>
      &nbsp;&nbsp;&nbsp;&nbsp;&nbsp;&nbsp;&nbsp;This option is only useful if you defined a nameFilter before&nbsp;
    </p>
    <p>
      &nbsp;&nbsp;&nbsp;&nbsp;&nbsp;&nbsp;&nbsp;but in the map there are also some files that doesn't match&nbsp;
    </p>
    <p>
      &nbsp;&nbsp;&nbsp;&nbsp;&nbsp;&nbsp;&nbsp;this filter definition&nbsp;
    </p>
    <p>
      &nbsp;&nbsp;&nbsp;&nbsp;&nbsp;&nbsp;&nbsp;(for example if you brought them manually or import them&nbsp;
    </p>
    <p>
      &nbsp;&nbsp;&nbsp;&nbsp;&nbsp;&nbsp;&nbsp;before the actual namefilter setting)&nbsp;&nbsp;
    </p>
    <p>
      
    </p>
    <p>
      &nbsp;&nbsp;&nbsp;&nbsp;- default is 0 which means don't check --&gt; Mark node as missing also if it doesn't match the current filter,
    </p>
    <p>
      
    </p>
    <p>
      &nbsp;&nbsp;&nbsp;&nbsp;- set to 1 to extra check if a not matching file still exists in drive&nbsp;
    </p>
    <p>
      
    </p>
    <p>
      
    </p>
    <p>
      ==========================================
    </p>
    <p>
      &nbsp;&nbsp;&nbsp;
    </p>
  </body>
</html></richcontent>
<node TEXT="otras ubicaciones posibles" STYLE_REF="locked" FOLDED="true" ID="ID_399374123"><richcontent CONTENT-TYPE="xml/" TYPE="DETAILS">
<html>
  <head>
    
  </head>
  <body>
    <p>
      en orden de prioridad
    </p>
  </body>
</html></richcontent>
<node TEXT="Freeplane_Tutorial_AddOn" ID="ID_1010951240" LINK="file:/C:/Users/Edo/Documents/GitHub/Freeplane_Tutorial_AddOn/"><richcontent CONTENT-TYPE="xml/" TYPE="DETAILS">
<html>
  <head>
    
  </head>
  <body>
    <p>
      notebook edo
    </p>
  </body>
</html></richcontent>
<attribute NAME="lastModifiedTime" VALUE="24-12-21 11:45" OBJECT="org.freeplane.features.format.FormattedDate|2021-12-24T11:45-0300|dd-MM-yy HH:mm"/>
<attribute NAME="lastAccessTime" VALUE="02-03-22 19:06" OBJECT="org.freeplane.features.format.FormattedDate|2022-03-02T19:06-0300|dd-MM-yy HH:mm"/>
<attribute NAME="creationTime" VALUE="12-09-21 15:08" OBJECT="org.freeplane.features.format.FormattedDate|2021-09-12T15:08-0300|datetime"/>
<attribute NAME="fileSize" VALUE="4.096" OBJECT="org.freeplane.features.format.FormattedNumber|4096|#,##0"/>
</node>
<node TEXT="Freeplane_Tutorial_AddOn" STYLE_REF="missing" ID="ID_437551640" LINK="file:/D:/Users/Edo/Documents/GitHub/Freeplane_Tutorial_AddOn/"><richcontent CONTENT-TYPE="xml/" TYPE="DETAILS">
<html>
  <head>
    
  </head>
  <body>
    <p>
      disco externo D:
    </p>
  </body>
</html></richcontent>
</node>
</node>
<node TEXT="files" ID="ID_1937875223">
<node TEXT=".gitattributes" ID="ID_1628624218" LINK="file:/C:/Users/Edo/Documents/GitHub/Freeplane_Tutorial_AddOn/.gitattributes">
<attribute NAME="lastModifiedTime" VALUE="13-09-21 18:07" OBJECT="org.freeplane.features.format.FormattedDate|2021-09-13T18:07-0300|datetime"/>
<attribute NAME="lastAccessTime" VALUE="18-03-22 23:52" OBJECT="org.freeplane.features.format.FormattedDate|2022-03-18T23:52-0300|dd-MM-yy HH:mm"/>
<attribute NAME="creationTime" VALUE="13-09-21 18:07" OBJECT="org.freeplane.features.format.FormattedDate|2021-09-13T18:07-0300|datetime"/>
<attribute NAME="fileSize" VALUE="66" OBJECT="org.freeplane.features.format.FormattedNumber|66|#,##0"/>
</node>
<node TEXT="delete" STYLE_REF="file_folder" FOLDED="true" ID="ID_350607696" LINK="file:/C:/Users/Edo/Documents/GitHub/Freeplane_Tutorial_AddOn/delete/">
<attribute NAME="lastModifiedTime" VALUE="24-12-21 11:45" OBJECT="org.freeplane.features.format.FormattedDate|2021-12-24T11:45-0300|datetime"/>
<attribute NAME="lastAccessTime" VALUE="21-03-22 12:27" OBJECT="org.freeplane.features.format.FormattedDate|2022-03-21T12:27-0300|dd-MM-yy HH:mm"/>
<attribute NAME="creationTime" VALUE="24-12-21 11:45" OBJECT="org.freeplane.features.format.FormattedDate|2021-12-24T11:45-0300|datetime"/>
<attribute NAME="fileSize" VALUE="0" OBJECT="org.freeplane.features.format.FormattedNumber|0|#,##0"/>
<node TEXT="MarkdownPreviewOld.groovy" ID="ID_453738727" LINK="file:/C:/Users/Edo/Documents/GitHub/Freeplane_Tutorial_AddOn/delete/MarkdownPreviewOld.groovy"><richcontent TYPE="NOTE" CONTENT-TYPE="xml/">
<html>
  <head>
    
  </head>
  <body>
    <p>
      package edofro.MarkDownHelper
    </p>
    <p>
      
    </p>
    <p>
      //region: imports
    </p>
    <p>
      
    </p>
    <p>
      import groovy.swing.SwingBuilder
    </p>
    <p>
      import javax.swing.*
    </p>
    <p>
      import java.awt.*
    </p>
    <p>
      
    </p>
    <p>
      import org.freeplane.features.map.INodeChangeListener
    </p>
    <p>
      import org.freeplane.features.map.NodeChangeEvent
    </p>
    <p>
      import org.freeplane.features.map.NodeModel
    </p>
    <p>
      import org.freeplane.features.mode.Controller
    </p>
    <p>
      
    </p>
    <p>
      import org.freeplane.core.ui.components.UITools
    </p>
    <p>
      import org.freeplane.plugin.script.proxy.ScriptUtils
    </p>
    <p>
      
    </p>
    <p>
      import edofro.tutorialomatic.ToM_ui&nbsp;&nbsp;&nbsp;&nbsp;&nbsp;&nbsp;as tomui
    </p>
    <p>
      
    </p>
    <p>
      //end:
    </p>
    <p>
      
    </p>
    <p>
      class MarkdownPreview {
    </p>
    <p>
      
    </p>
    <p>
      &nbsp;&nbsp;&nbsp;&nbsp;//region: properties
    </p>
    <p>
      &nbsp;&nbsp;&nbsp;&nbsp;
    </p>
    <p>
      &nbsp;&nbsp;&nbsp;&nbsp;SwingBuilder swing = new SwingBuilder()
    </p>
    <p>
      &nbsp;&nbsp;&nbsp;&nbsp;def dialogName = 'frameNota'
    </p>
    <p>
      &nbsp;&nbsp;&nbsp;&nbsp;def myPaneName = 'myContentPanel'
    </p>
    <p>
      &nbsp;&nbsp;&nbsp;&nbsp;def iniMsg = '----- select the node with the note you want to view and click the button ----'
    </p>
    <p>
      &nbsp;&nbsp;&nbsp;&nbsp;def c = ScriptUtils.c()
    </p>
    <p>
      &nbsp;&nbsp;&nbsp;&nbsp;final String htmlStyle&nbsp;&nbsp;&nbsp;&nbsp;&nbsp;&nbsp;&nbsp;&nbsp;&nbsp;=
    </p>
    <p>
      &nbsp;&nbsp;&nbsp;&nbsp;&nbsp;&nbsp;&nbsp;&nbsp;&quot;&quot;&quot;
    </p>
    <p>
      &nbsp;&nbsp;&nbsp;&nbsp;&nbsp;&nbsp;&nbsp;&nbsp;&nbsp;&nbsp;&nbsp;&nbsp;table {border: 0; border-spacing: 0;}
    </p>
    <p>
      &nbsp;&nbsp;&nbsp;&nbsp;&nbsp;&nbsp;&nbsp;&nbsp;&nbsp;&nbsp;&nbsp;&nbsp;th, td {border: 1px solid;}
    </p>
    <p>
      &nbsp;&nbsp;&nbsp;&nbsp;&nbsp;&nbsp;&nbsp;&nbsp;&nbsp;&nbsp;&nbsp;&nbsp;pre {
    </p>
    <p>
      &nbsp;&nbsp;&nbsp;&nbsp;&nbsp;&nbsp;&nbsp;&nbsp;&nbsp;&nbsp;&nbsp;&nbsp;&nbsp;&nbsp;&nbsp;&nbsp;background-color: rgb(230, 230, 230);
    </p>
    <p>
      &nbsp;&nbsp;&nbsp;&nbsp;&nbsp;&nbsp;&nbsp;&nbsp;&nbsp;&nbsp;&nbsp;&nbsp;&nbsp;&nbsp;&nbsp;&nbsp;border: 1px solid rgb(0, 0, 0);
    </p>
    <p>
      &nbsp;&nbsp;&nbsp;&nbsp;&nbsp;&nbsp;&nbsp;&nbsp;&nbsp;&nbsp;&nbsp;&nbsp;&nbsp;&nbsp;&nbsp;&nbsp;display: block;
    </p>
    <p>
      &nbsp;&nbsp;&nbsp;&nbsp;&nbsp;&nbsp;&nbsp;&nbsp;&nbsp;&nbsp;&nbsp;&nbsp;&nbsp;&nbsp;&nbsp;&nbsp;padding: 10px;
    </p>
    <p>
      &nbsp;&nbsp;&nbsp;&nbsp;&nbsp;&nbsp;&nbsp;&nbsp;&nbsp;&nbsp;&nbsp;&nbsp;}
    </p>
    <p>
      &nbsp;&nbsp;&nbsp;&nbsp;&nbsp;&nbsp;&nbsp;&nbsp;&nbsp;&nbsp;&nbsp;&nbsp;code {
    </p>
    <p>
      &nbsp;&nbsp;&nbsp;&nbsp;&nbsp;&nbsp;&nbsp;&nbsp;&nbsp;&nbsp;&nbsp;&nbsp;&nbsp;&nbsp;&nbsp;&nbsp;font-family: Consolas,&quot;courier new&quot;;
    </p>
    <p>
      &nbsp;&nbsp;&nbsp;&nbsp;&nbsp;&nbsp;&nbsp;&nbsp;&nbsp;&nbsp;&nbsp;&nbsp;&nbsp;&nbsp;&nbsp;&nbsp;color: rgb(0, 80, 0);
    </p>
    <p>
      &nbsp;&nbsp;&nbsp;&nbsp;&nbsp;&nbsp;&nbsp;&nbsp;&nbsp;&nbsp;&nbsp;&nbsp;}
    </p>
    <p>
      &nbsp;&nbsp;&nbsp;&nbsp;&nbsp;&nbsp;&nbsp;&nbsp;&quot;&quot;&quot;
    </p>
    <p>
      &nbsp;&nbsp;&nbsp;&nbsp;
    </p>
    <p>
      &nbsp;&nbsp;&nbsp;&nbsp;//end:
    </p>
    <p>
      
    </p>
    <p>
      &nbsp;&nbsp;&nbsp;&nbsp;//region: constructor
    </p>
    <p>
      &nbsp;&nbsp;&nbsp;&nbsp;
    </p>
    <p>
      &nbsp;&nbsp;&nbsp;&nbsp;public MarkdownPreview(){
    </p>
    <p>
      &nbsp;&nbsp;&nbsp;&nbsp;&nbsp;&nbsp;&nbsp;&nbsp;
    </p>
    <p>
      &nbsp;&nbsp;&nbsp;&nbsp;&nbsp;&nbsp;&nbsp;&nbsp;def contentPane = swing.panel(
    </p>
    <p>
      &nbsp;&nbsp;&nbsp;&nbsp;&nbsp;&nbsp;&nbsp;&nbsp;&nbsp;&nbsp;&nbsp;&nbsp;&nbsp;&nbsp;&nbsp;&nbsp;name: myPaneName,
    </p>
    <p>
      &nbsp;&nbsp;&nbsp;&nbsp;&nbsp;&nbsp;&nbsp;&nbsp;&nbsp;&nbsp;&nbsp;&nbsp;&nbsp;&nbsp;&nbsp;&nbsp;layout: new GridBagLayout(),
    </p>
    <p>
      &nbsp;&nbsp;&nbsp;&nbsp;&nbsp;&nbsp;&nbsp;&nbsp;&nbsp;&nbsp;&nbsp;&nbsp;&nbsp;&nbsp;&nbsp;&nbsp;background: Color.gray,
    </p>
    <p>
      &nbsp;&nbsp;&nbsp;&nbsp;&nbsp;&nbsp;&nbsp;&nbsp;&nbsp;&nbsp;&nbsp;&nbsp;){}
    </p>
    <p>
      
    </p>
    <p>
      &nbsp;&nbsp;&nbsp;&nbsp;&nbsp;&nbsp;&nbsp;&nbsp;def notePane = tomui.createInstructionsPane(iniMsg)
    </p>
    <p>
      
    </p>
    <p>
      &nbsp;&nbsp;&nbsp;&nbsp;&nbsp;&nbsp;&nbsp;&nbsp;//return notePane.text
    </p>
    <p>
      
    </p>
    <p>
      &nbsp;&nbsp;&nbsp;&nbsp;&nbsp;&nbsp;&nbsp;&nbsp;contentPane.add(notePane, tomui.GBC)
    </p>
    <p>
      
    </p>
    <p>
      &nbsp;&nbsp;&nbsp;&nbsp;&nbsp;&nbsp;&nbsp;&nbsp;def sp = tomui.createScrollPaneForContentPane(contentPane)
    </p>
    <p>
      
    </p>
    <p>
      
    </p>
    <p>
      &nbsp;&nbsp;&nbsp;&nbsp;&nbsp;&nbsp;&nbsp;&nbsp;def buttonPanel = {
    </p>
    <p>
      &nbsp;&nbsp;&nbsp;&nbsp;&nbsp;&nbsp;&nbsp;&nbsp;&nbsp;&nbsp;&nbsp;swing.panel(constraints : BorderLayout.NORTH) {
    </p>
    <p>
      &nbsp;&nbsp;&nbsp;&nbsp;&nbsp;&nbsp;&nbsp;&nbsp;&nbsp;&nbsp;&nbsp;&nbsp;&nbsp;&nbsp;toggleButton(
    </p>
    <p>
      &nbsp;&nbsp;&nbsp;&nbsp;&nbsp;&nbsp;&nbsp;&nbsp;&nbsp;&nbsp;&nbsp;&nbsp;&nbsp;&nbsp;&nbsp;&nbsp;&nbsp;&nbsp;text : 'Activate Listener',
    </p>
    <p>
      &nbsp;&nbsp;&nbsp;&nbsp;&nbsp;&nbsp;&nbsp;&nbsp;&nbsp;&nbsp;&nbsp;&nbsp;&nbsp;&nbsp;&nbsp;&nbsp;&nbsp;&nbsp;margin&nbsp;&nbsp;&nbsp;&nbsp;&nbsp;&nbsp;: new Insets(10,15,10,15),
    </p>
    <p>
      &nbsp;&nbsp;&nbsp;&nbsp;&nbsp;&nbsp;&nbsp;&nbsp;&nbsp;&nbsp;&nbsp;&nbsp;&nbsp;&nbsp;&nbsp;&nbsp;&nbsp;&nbsp;actionPerformed : {e -&gt;
    </p>
    <p>
      &nbsp;&nbsp;&nbsp;&nbsp;&nbsp;&nbsp;&nbsp;&nbsp;&nbsp;&nbsp;&nbsp;&nbsp;&nbsp;&nbsp;&nbsp;&nbsp;&nbsp;&nbsp;&nbsp;&nbsp;&nbsp;&nbsp;&nbsp;&nbsp;def bttn = e.source
    </p>
    <p>
      &nbsp;&nbsp;&nbsp;&nbsp;&nbsp;&nbsp;&nbsp;&nbsp;&nbsp;&nbsp;&nbsp;&nbsp;&nbsp;&nbsp;&nbsp;&nbsp;&nbsp;&nbsp;&nbsp;&nbsp;&nbsp;&nbsp;&nbsp;&nbsp;bttn.text = activateListener(notePane, c.selected)
    </p>
    <p>
      &nbsp;&nbsp;&nbsp;&nbsp;&nbsp;&nbsp;&nbsp;&nbsp;&nbsp;&nbsp;&nbsp;&nbsp;&nbsp;&nbsp;&nbsp;&nbsp;&nbsp;}
    </p>
    <p>
      &nbsp;&nbsp;&nbsp;&nbsp;&nbsp;&nbsp;&nbsp;&nbsp;&nbsp;&nbsp;&nbsp;&nbsp;&nbsp;&nbsp;)
    </p>
    <p>
      &nbsp;&nbsp;&nbsp;&nbsp;&nbsp;&nbsp;&nbsp;&nbsp;&nbsp;&nbsp;&nbsp;}
    </p>
    <p>
      &nbsp;&nbsp;&nbsp;&nbsp;&nbsp;&nbsp;&nbsp;&nbsp;}
    </p>
    <p>
      
    </p>
    <p>
      &nbsp;&nbsp;&nbsp;&nbsp;&nbsp;&nbsp;&nbsp;&nbsp;def noteFrame = swing.frame(
    </p>
    <p>
      &nbsp;&nbsp;&nbsp;&nbsp;&nbsp;&nbsp;&nbsp;&nbsp;&nbsp;&nbsp;&nbsp;&nbsp;title : 'Markdown Note',
    </p>
    <p>
      &nbsp;&nbsp;&nbsp;&nbsp;&nbsp;&nbsp;&nbsp;&nbsp;&nbsp;&nbsp;&nbsp;&nbsp;//id:'myDialog',
    </p>
    <p>
      &nbsp;&nbsp;&nbsp;&nbsp;&nbsp;&nbsp;&nbsp;&nbsp;&nbsp;&nbsp;&nbsp;&nbsp;name: dialogName,
    </p>
    <p>
      &nbsp;&nbsp;&nbsp;&nbsp;&nbsp;&nbsp;&nbsp;&nbsp;&nbsp;&nbsp;&nbsp;// modal:false,
    </p>
    <p>
      &nbsp;&nbsp;&nbsp;&nbsp;&nbsp;&nbsp;&nbsp;&nbsp;&nbsp;&nbsp;&nbsp;&nbsp;locationRelativeTo:UITools.frame,
    </p>
    <p>
      &nbsp;&nbsp;&nbsp;&nbsp;&nbsp;&nbsp;&nbsp;&nbsp;&nbsp;&nbsp;&nbsp;&nbsp;preferredSize: new Dimension(450,400),
    </p>
    <p>
      &nbsp;&nbsp;&nbsp;&nbsp;&nbsp;&nbsp;&nbsp;&nbsp;&nbsp;&nbsp;&nbsp;// owner:UITools.frame,
    </p>
    <p>
      &nbsp;&nbsp;&nbsp;&nbsp;&nbsp;&nbsp;&nbsp;&nbsp;&nbsp;&nbsp;&nbsp;&nbsp;defaultCloseOperation: JFrame.DISPOSE_ON_CLOSE,
    </p>
    <p>
      &nbsp;&nbsp;&nbsp;&nbsp;&nbsp;&nbsp;&nbsp;&nbsp;&nbsp;&nbsp;&nbsp;&nbsp;pack : true,
    </p>
    <p>
      &nbsp;&nbsp;&nbsp;&nbsp;&nbsp;&nbsp;&nbsp;&nbsp;&nbsp;&nbsp;&nbsp;&nbsp;show : true,
    </p>
    <p>
      &nbsp;&nbsp;&nbsp;&nbsp;&nbsp;&nbsp;&nbsp;&nbsp;) {
    </p>
    <p>
      &nbsp;&nbsp;&nbsp;&nbsp;&nbsp;&nbsp;&nbsp;&nbsp;&nbsp;&nbsp;&nbsp;&nbsp;buttonPanel()
    </p>
    <p>
      
    </p>
    <p>
      &nbsp;&nbsp;&nbsp;&nbsp;&nbsp;&nbsp;&nbsp;&nbsp;}
    </p>
    <p>
      
    </p>
    <p>
      &nbsp;&nbsp;&nbsp;&nbsp;&nbsp;&nbsp;&nbsp;&nbsp;//noteFrame.add(createActivateButtonPane())
    </p>
    <p>
      &nbsp;&nbsp;&nbsp;&nbsp;&nbsp;&nbsp;&nbsp;&nbsp;noteFrame.add(sp)
    </p>
    <p>
      &nbsp;&nbsp;&nbsp;&nbsp;}
    </p>
    <p>
      &nbsp;&nbsp;&nbsp;&nbsp;
    </p>
    <p>
      &nbsp;&nbsp;&nbsp;&nbsp;//end:
    </p>
    <p>
      &nbsp;&nbsp;&nbsp;&nbsp;
    </p>
    <p>
      &nbsp;&nbsp;&nbsp;&nbsp;//region: methods
    </p>
    <p>
      
    </p>
    <p>
      &nbsp;&nbsp;&nbsp;&nbsp;def activateListener(comp, nodo){
    </p>
    <p>
      &nbsp;&nbsp;&nbsp;&nbsp;&nbsp;&nbsp;&nbsp;&nbsp;def mapController = Controller.currentModeController.mapController;
    </p>
    <p>
      &nbsp;&nbsp;&nbsp;&nbsp;&nbsp;&nbsp;&nbsp;&nbsp;def listenerFound = false;
    </p>
    <p>
      
    </p>
    <p>
      &nbsp;&nbsp;&nbsp;&nbsp;&nbsp;&nbsp;&nbsp;&nbsp;(mapController.nodeChangeListeners.findAll { it.class.name == MyNodeChangeListener.class.name }).each {
    </p>
    <p>
      &nbsp;&nbsp;&nbsp;&nbsp;&nbsp;&nbsp;&nbsp;&nbsp;&nbsp;&nbsp;&nbsp;&nbsp;mapController.removeNodeChangeListener(it);
    </p>
    <p>
      &nbsp;&nbsp;&nbsp;&nbsp;&nbsp;&nbsp;&nbsp;&nbsp;&nbsp;&nbsp;&nbsp;&nbsp;listenerFound = true;
    </p>
    <p>
      &nbsp;&nbsp;&nbsp;&nbsp;&nbsp;&nbsp;&nbsp;&nbsp;}
    </p>
    <p>
      
    </p>
    <p>
      &nbsp;&nbsp;&nbsp;&nbsp;&nbsp;&nbsp;&nbsp;&nbsp;if (listenerFound) {
    </p>
    <p>
      &nbsp;&nbsp;&nbsp;&nbsp;&nbsp;&nbsp;&nbsp;&nbsp;&nbsp;&nbsp;&nbsp;&nbsp;comp.text = iniMsg
    </p>
    <p>
      &nbsp;&nbsp;&nbsp;&nbsp;&nbsp;&nbsp;&nbsp;&nbsp;&nbsp;&nbsp;&nbsp;&nbsp;return 'Listener deactivated..'
    </p>
    <p>
      &nbsp;&nbsp;&nbsp;&nbsp;&nbsp;&nbsp;&nbsp;&nbsp;}
    </p>
    <p>
      
    </p>
    <p>
      &nbsp;&nbsp;&nbsp;&nbsp;&nbsp;&nbsp;&nbsp;&nbsp;def myChgListener = new MyNodeChangeListener(comp, nodo );
    </p>
    <p>
      &nbsp;&nbsp;&nbsp;&nbsp;&nbsp;&nbsp;&nbsp;&nbsp;mapController.addNodeChangeListener(myChgListener);
    </p>
    <p>
      &nbsp;&nbsp;&nbsp;&nbsp;&nbsp;&nbsp;&nbsp;&nbsp;comp.text = getHtmlFromNote(nodo)
    </p>
    <p>
      &nbsp;&nbsp;&nbsp;&nbsp;&nbsp;&nbsp;&nbsp;&nbsp;return nodo.text.take(30)
    </p>
    <p>
      &nbsp;&nbsp;&nbsp;&nbsp;}
    </p>
    <p>
      &nbsp;&nbsp;&nbsp;&nbsp;
    </p>
    <p>
      &nbsp;&nbsp;&nbsp;&nbsp;def getHtmlFromNote(nodo){
    </p>
    <p>
      &nbsp;&nbsp;&nbsp;&nbsp;&nbsp;&nbsp;&nbsp;&nbsp;if(!nodo.note) return null
    </p>
    <p>
      &nbsp;&nbsp;&nbsp;&nbsp;&nbsp;&nbsp;&nbsp;&nbsp;def noteType = nodo.noteContentType
    </p>
    <p>
      &nbsp;&nbsp;&nbsp;&nbsp;&nbsp;&nbsp;&nbsp;&nbsp;def html
    </p>
    <p>
      &nbsp;&nbsp;&nbsp;&nbsp;&nbsp;&nbsp;&nbsp;&nbsp;switch (noteType){
    </p>
    <p>
      &nbsp;&nbsp;&nbsp;&nbsp;&nbsp;&nbsp;&nbsp;&nbsp;&nbsp;&nbsp;&nbsp;&nbsp;case ['auto','html']:
    </p>
    <p>
      &nbsp;&nbsp;&nbsp;&nbsp;&nbsp;&nbsp;&nbsp;&nbsp;&nbsp;&nbsp;&nbsp;&nbsp;&nbsp;&nbsp;&nbsp;&nbsp;html = nodo.plainNote.startsWith('=')?nodo.note.plain:nodo.note.html
    </p>
    <p>
      &nbsp;&nbsp;&nbsp;&nbsp;&nbsp;&nbsp;&nbsp;&nbsp;&nbsp;&nbsp;&nbsp;&nbsp;&nbsp;&nbsp;&nbsp;&nbsp;break
    </p>
    <p>
      &nbsp;&nbsp;&nbsp;&nbsp;&nbsp;&nbsp;&nbsp;&nbsp;&nbsp;&nbsp;&nbsp;&nbsp;case 'markdown':
    </p>
    <p>
      &nbsp;&nbsp;&nbsp;&nbsp;&nbsp;&nbsp;&nbsp;&nbsp;&nbsp;&nbsp;&nbsp;&nbsp;&nbsp;&nbsp;&nbsp;&nbsp;html = &quot;&quot;&quot;&lt;html&gt;
    </p>
    <p>
      &nbsp;&nbsp;&nbsp;&nbsp;&nbsp;&nbsp;&nbsp;&nbsp;&nbsp;&nbsp;&nbsp;&nbsp;&nbsp;&nbsp;&nbsp;&nbsp;&nbsp;&nbsp;&nbsp;&nbsp;&nbsp;&nbsp;&nbsp;&nbsp;&nbsp;&nbsp;&nbsp;&nbsp;&lt;style&gt;${htmlStyle}&lt;/style&gt;
    </p>
    <p>
      &nbsp;&nbsp;&nbsp;&nbsp;&nbsp;&nbsp;&nbsp;&nbsp;&nbsp;&nbsp;&nbsp;&nbsp;&nbsp;&nbsp;&nbsp;&nbsp;&nbsp;&nbsp;&nbsp;&nbsp;&nbsp;&nbsp;&nbsp;&nbsp;&nbsp;&nbsp;&nbsp;&nbsp;&lt;body&gt;
    </p>
    <p>
      &nbsp;&nbsp;&nbsp;&nbsp;&nbsp;&nbsp;&nbsp;&nbsp;&nbsp;&nbsp;&nbsp;&nbsp;&nbsp;&nbsp;&nbsp;&nbsp;&nbsp;&nbsp;&nbsp;&nbsp;&nbsp;&nbsp;&nbsp;&nbsp;&nbsp;&nbsp;&nbsp;&nbsp;&nbsp;&nbsp;&nbsp;&nbsp;${Marked.marked(nodo.note.plain)}
    </p>
    <p>
      &nbsp;&nbsp;&nbsp;&nbsp;&nbsp;&nbsp;&nbsp;&nbsp;&nbsp;&nbsp;&nbsp;&nbsp;&nbsp;&nbsp;&nbsp;&nbsp;&nbsp;&nbsp;&nbsp;&nbsp;&nbsp;&nbsp;&nbsp;&nbsp;&nbsp;&nbsp;&nbsp;&nbsp;&lt;/body&gt;
    </p>
    <p>
      &nbsp;&nbsp;&nbsp;&nbsp;&nbsp;&nbsp;&nbsp;&nbsp;&nbsp;&nbsp;&nbsp;&nbsp;&nbsp;&nbsp;&nbsp;&nbsp;&nbsp;&nbsp;&nbsp;&nbsp;&nbsp;&nbsp;&nbsp;&nbsp;&lt;/html&gt;&quot;&quot;&quot;
    </p>
    <p>
      &nbsp;&nbsp;&nbsp;&nbsp;&nbsp;&nbsp;&nbsp;&nbsp;&nbsp;&nbsp;&nbsp;&nbsp;&nbsp;&nbsp;&nbsp;&nbsp;break
    </p>
    <p>
      &nbsp;&nbsp;&nbsp;&nbsp;&nbsp;&nbsp;&nbsp;&nbsp;&nbsp;&nbsp;&nbsp;&nbsp;default:
    </p>
    <p>
      &nbsp;&nbsp;&nbsp;&nbsp;&nbsp;&nbsp;&nbsp;&nbsp;&nbsp;&nbsp;&nbsp;&nbsp;&nbsp;&nbsp;&nbsp;&nbsp;html = &quot;Node's note not recognized&quot;
    </p>
    <p>
      &nbsp;&nbsp;&nbsp;&nbsp;&nbsp;&nbsp;&nbsp;&nbsp;&nbsp;&nbsp;&nbsp;&nbsp;&nbsp;&nbsp;&nbsp;&nbsp;break
    </p>
    <p>
      &nbsp;&nbsp;&nbsp;&nbsp;&nbsp;&nbsp;&nbsp;&nbsp;}
    </p>
    <p>
      &nbsp;&nbsp;&nbsp;&nbsp;&nbsp;&nbsp;&nbsp;&nbsp;return html
    </p>
    <p>
      &nbsp;&nbsp;&nbsp;&nbsp;}
    </p>
    <p>
      
    </p>
    <p>
      &nbsp;&nbsp;&nbsp;&nbsp;
    </p>
    <p>
      &nbsp;&nbsp;&nbsp;&nbsp;//end:
    </p>
    <p>
      &nbsp;&nbsp;&nbsp;&nbsp;
    </p>
    <p>
      &nbsp;&nbsp;&nbsp;&nbsp;//region: Listeners
    </p>
    <p>
      
    </p>
    <p>
      &nbsp;&nbsp;&nbsp;&nbsp;class MyNodeChangeListener implements INodeChangeListener {
    </p>
    <p>
      &nbsp;&nbsp;&nbsp;&nbsp;&nbsp;&nbsp;&nbsp;&nbsp;def comp;
    </p>
    <p>
      &nbsp;&nbsp;&nbsp;&nbsp;&nbsp;&nbsp;&nbsp;&nbsp;def node;
    </p>
    <p>
      
    </p>
    <p>
      &nbsp;&nbsp;&nbsp;&nbsp;&nbsp;&nbsp;&nbsp;&nbsp;MyNodeChangeListener(def component, nodo) {
    </p>
    <p>
      &nbsp;&nbsp;&nbsp;&nbsp;&nbsp;&nbsp;&nbsp;&nbsp;&nbsp;&nbsp;&nbsp;&nbsp;comp = component;
    </p>
    <p>
      &nbsp;&nbsp;&nbsp;&nbsp;&nbsp;&nbsp;&nbsp;&nbsp;&nbsp;&nbsp;&nbsp;&nbsp;node = nodo;
    </p>
    <p>
      &nbsp;&nbsp;&nbsp;&nbsp;&nbsp;&nbsp;&nbsp;&nbsp;}
    </p>
    <p>
      
    </p>
    <p>
      &nbsp;&nbsp;&nbsp;&nbsp;&nbsp;&nbsp;&nbsp;&nbsp;public void nodeChanged(NodeChangeEvent event) {
    </p>
    <p>
      &nbsp;&nbsp;&nbsp;&nbsp;&nbsp;&nbsp;&nbsp;&nbsp;&nbsp;&nbsp;&nbsp;&nbsp;Object property = event.property
    </p>
    <p>
      &nbsp;&nbsp;&nbsp;&nbsp;&nbsp;&nbsp;&nbsp;&nbsp;&nbsp;&nbsp;&nbsp;&nbsp;def id = event.node.getID()
    </p>
    <p>
      &nbsp;&nbsp;&nbsp;&nbsp;&nbsp;&nbsp;&nbsp;&nbsp;&nbsp;&nbsp;&nbsp;&nbsp;if (id == node.id) {
    </p>
    <p>
      &nbsp;&nbsp;&nbsp;&nbsp;&nbsp;&nbsp;&nbsp;&nbsp;&nbsp;&nbsp;&nbsp;&nbsp;&nbsp;&nbsp;&nbsp;&nbsp;comp.text = getHtmlFromNote(node)
    </p>
    <p>
      &nbsp;&nbsp;&nbsp;&nbsp;&nbsp;&nbsp;&nbsp;&nbsp;&nbsp;&nbsp;&nbsp;&nbsp;}
    </p>
    <p>
      &nbsp;&nbsp;&nbsp;&nbsp;&nbsp;&nbsp;&nbsp;&nbsp;}
    </p>
    <p>
      &nbsp;&nbsp;&nbsp;&nbsp;}
    </p>
    <p>
      
    </p>
    <p>
      
    </p>
    <p>
      &nbsp;&nbsp;&nbsp;&nbsp;//end:
    </p>
    <p>
      
    </p>
    <p>
      
    </p>
    <p>
      
    </p>
    <p>
      
    </p>
    <p>
      
    </p>
    <p>
      
    </p>
    <p>
      
    </p>
    <p>
      }
    </p>
    <p>
      
    </p>
    <p>
      //tomui.createScrollPaneForContentPane
    </p>
    <p>
      //tomui.createInstructionsPane(iniMsg)
    </p>
    <p>
      //tomui.GBC
    </p>
  </body>
</html></richcontent>
<attribute NAME="lastModifiedTime" VALUE="23-12-21 14:38" OBJECT="org.freeplane.features.format.FormattedDate|2021-12-23T14:38-0300|datetime"/>
<attribute NAME="lastAccessTime" VALUE="03-01-22 11:11" OBJECT="org.freeplane.features.format.FormattedDate|2022-01-03T11:11-0300|datetime"/>
<attribute NAME="creationTime" VALUE="07-12-21 19:46" OBJECT="org.freeplane.features.format.FormattedDate|2021-12-07T19:46-0300|datetime"/>
<attribute NAME="fileSize" VALUE="4.986" OBJECT="org.freeplane.features.format.FormattedNumber|4986|#,##0"/>
</node>
</node>
<node TEXT="Tutorial-o-Matic" STYLE_REF="file_folder" ID="ID_198136364" LINK="file:/C:/Users/Edo/Documents/GitHub/Freeplane_Tutorial_AddOn/Tutorial-o-Matic/">
<attribute NAME="script1" VALUE="def nodo = node&#xd;&#xa;def texto = nodo.text&#xd;&#xa;&#xd;&#xa;def nodos = nodo.find{it.text.contains(texto)}&#xd;&#xa;&#xd;&#xa;&#xd;&#xa;def cambiarA = ui.showInputDialog(&#xd;&#xa;        nodo.delegate, &#xd;&#xa;        &apos;input new AddOn name (it will CamelCase it and delete spaces)&apos;, &#xd;&#xa;        &apos; my new add on example   &apos;&#xd;&#xa;    )?.trim()&#xd;&#xa;&#xd;&#xa;cambiarA = cambiarA.split(&apos; &apos;)*.capitalize().join()&#xd;&#xa;&#xd;&#xa;nodos.each{n -&gt;&#xd;&#xa;    n.text = n.text.replace(texto,cambiarA)&#xd;&#xa;}"/>
<attribute NAME="lastModifiedTime" VALUE="08-03-22 22:20" OBJECT="org.freeplane.features.format.FormattedDate|2022-03-08T22:20-0300|dd-MM-yy HH:mm"/>
<attribute NAME="lastAccessTime" VALUE="21-03-22 12:29" OBJECT="org.freeplane.features.format.FormattedDate|2022-03-21T12:29-0300|dd-MM-yy HH:mm"/>
<attribute NAME="creationTime" VALUE="12-09-21 15:12" OBJECT="org.freeplane.features.format.FormattedDate|2021-09-12T15:12-0300|datetime"/>
<attribute NAME="fileSize" VALUE="4.096" OBJECT="org.freeplane.features.format.FormattedNumber|4096|#,##0"/>
<node TEXT="lib" STYLE_REF="Organizador" ID="ID_1868195332">
<attribute NAME="projectCode" VALUE="lib"/>
<node TEXT="src" STYLE_REF="file_folder" ID="ID_776042065" LINK="file:/C:/Users/Edo/Documents/GitHub/Freeplane_Tutorial_AddOn/Tutorial-o-Matic/src/">
<attribute NAME="lastModifiedTime" VALUE="12-09-21 15:12" OBJECT="org.freeplane.features.format.FormattedDate|2021-09-12T15:12-0300|datetime"/>
<attribute NAME="lastAccessTime" VALUE="21-03-22 12:27" OBJECT="org.freeplane.features.format.FormattedDate|2022-03-21T12:27-0300|dd-MM-yy HH:mm"/>
<attribute NAME="creationTime" VALUE="12-09-21 15:12" OBJECT="org.freeplane.features.format.FormattedDate|2021-09-12T15:12-0300|datetime"/>
<attribute NAME="fileSize" VALUE="0" OBJECT="org.freeplane.features.format.FormattedNumber|0|#,##0"/>
<node TEXT="main" STYLE_REF="file_folder" ID="ID_1231327159" LINK="file:/C:/Users/Edo/Documents/GitHub/Freeplane_Tutorial_AddOn/Tutorial-o-Matic/src/main/">
<attribute NAME="lastModifiedTime" VALUE="20-09-21 10:00" OBJECT="org.freeplane.features.format.FormattedDate|2021-09-20T10:00-0300|datetime"/>
<attribute NAME="lastAccessTime" VALUE="21-03-22 12:27" OBJECT="org.freeplane.features.format.FormattedDate|2022-03-21T12:27-0300|dd-MM-yy HH:mm"/>
<attribute NAME="creationTime" VALUE="12-09-21 15:12" OBJECT="org.freeplane.features.format.FormattedDate|2021-09-12T15:12-0300|datetime"/>
<attribute NAME="fileSize" VALUE="0" OBJECT="org.freeplane.features.format.FormattedNumber|0|#,##0"/>
<node TEXT="groovy" STYLE_REF="file_folder" ID="ID_1868302349" LINK="file:/C:/Users/Edo/Documents/GitHub/Freeplane_Tutorial_AddOn/Tutorial-o-Matic/src/main/groovy/">
<attribute NAME="lastModifiedTime" VALUE="17-03-22 09:08" OBJECT="org.freeplane.features.format.FormattedDate|2022-03-17T09:08-0300|dd-MM-yy HH:mm"/>
<attribute NAME="lastAccessTime" VALUE="21-03-22 12:27" OBJECT="org.freeplane.features.format.FormattedDate|2022-03-21T12:27-0300|dd-MM-yy HH:mm"/>
<attribute NAME="creationTime" VALUE="12-09-21 15:12" OBJECT="org.freeplane.features.format.FormattedDate|2021-09-12T15:12-0300|datetime"/>
<attribute NAME="fileSize" VALUE="4.096" OBJECT="org.freeplane.features.format.FormattedNumber|4096|#,##0"/>
<node TEXT="TabPane.groovy" FOLDED="true" ID="ID_736919810" LINK="file:/C:/Users/Edo/Documents/GitHub/Freeplane_Tutorial_AddOn/Tutorial-o-Matic/src/main/groovy/TabPane.groovy">
<icon BUILTIN="bookmarks/Bookmark 1"/>
<attribute NAME="lastModifiedTime" VALUE="10-03-22 11:33" OBJECT="org.freeplane.features.format.FormattedDate|2022-03-10T11:33-0300|dd-MM-yy HH:mm"/>
<attribute NAME="lastAccessTime" VALUE="20-03-22 22:33" OBJECT="org.freeplane.features.format.FormattedDate|2022-03-20T22:33-0300|dd-MM-yy HH:mm"/>
<attribute NAME="creationTime" VALUE="12-09-21 15:43" OBJECT="org.freeplane.features.format.FormattedDate|2021-09-12T15:43-0300|datetime"/>
<attribute NAME="fileSize" VALUE="2.642" OBJECT="org.freeplane.features.format.FormattedNumber|2642|#,##0"/>
<attribute NAME="projectCode" VALUE="TabPane.grvy"/>
<node TEXT="TabPannel" FOLDED="true" ID="ID_566681188">
<node TEXT="listo!!" FOLDED="true" ID="ID_830035512"><richcontent CONTENT-TYPE="xml/" TYPE="DETAILS">
<html>
  <head>
    
  </head>
  <body>
    <p>
      completedTask
    </p>
  </body>
</html></richcontent>
<node TEXT="eliminar tab de tabbed pannel" ID="ID_34964401"><richcontent TYPE="NOTE" CONTENT-TYPE="xml/">
<html>
  <head>
    
  </head>
  <body>
    <p>
      def tabName = 'Tutorial'
    </p>
    <p>
      
    </p>
    <p>
      def tabPane = ui.freeplaneTabbedPanel
    </p>
    <p>
      def index = tabPane.indexOfTab(tabName)
    </p>
    <p>
      
    </p>
    <p>
      //eliminar
    </p>
    <p>
      if(index &gt;= 0) {
    </p>
    <p>
      &nbsp;&nbsp;&nbsp;&nbsp;tabPane.removeTabAt(index)
    </p>
    <p>
      }
    </p>
  </body>
</html></richcontent>
<richcontent CONTENT-TYPE="xml/" TYPE="DETAILS">
<html>
  <head>
    
  </head>
  <body>
    <p>
      .groovy
    </p>
  </body>
</html></richcontent>
</node>
<node TEXT="mostrar Tabbed panel y mostrar tab" ID="ID_705029529"><richcontent TYPE="NOTE" CONTENT-TYPE="xml/">
<html>
  <head>
    
  </head>
  <body>
    <p>
      def tabPane = ui.freeplaneTabbedPanel
    </p>
    <p>
      
    </p>
    <p>
      if(!tabPane.isShowing()) {
    </p>
    <p>
      &nbsp;&nbsp;&nbsp;&nbsp;menuUtils.executeMenuItems(['ShowFormatPanel'])
    </p>
    <p>
      }
    </p>
    <p>
      
    </p>
    <p>
      def tabName = 'Tutorial'
    </p>
    <p>
      def index = tabPane.indexOfTab(tabName)
    </p>
    <p>
      if (index&gt;=0) {
    </p>
    <p>
      &nbsp;&nbsp;&nbsp;&nbsp;tabPane.selectedIndex = index
    </p>
    <p>
      }
    </p>
  </body>
</html></richcontent>
<richcontent CONTENT-TYPE="xml/" TYPE="DETAILS">
<html>
  <head>
    
  </head>
  <body>
    <p>
      .groovy
    </p>
  </body>
</html></richcontent>
</node>
<node TEXT="agregar tab a freeplaneTabbedPanel" ID="ID_990420067"><richcontent TYPE="NOTE" CONTENT-TYPE="xml/">
<html>
  <head>
    
  </head>
  <body>
    <p>
      import groovy.swing.SwingBuilder
    </p>
    <p>
      
    </p>
    <p>
      import java.awt.Color
    </p>
    <p>
      import java.awt.Font
    </p>
    <p>
      
    </p>
    <p>
      def tabName = 'Tutorial'
    </p>
    <p>
      
    </p>
    <p>
      def tabPane = ui.freeplaneTabbedPanel
    </p>
    <p>
      
    </p>
    <p>
      
    </p>
    <p>
      SwingBuilder swing = new SwingBuilder()
    </p>
    <p>
      def panel = swing.panel(){
    </p>
    <p>
      &nbsp;&nbsp;&nbsp;&nbsp;label(
    </p>
    <p>
      &nbsp;&nbsp;&nbsp;&nbsp;&nbsp;&nbsp;&nbsp;&nbsp;text : &quot;Hola, hola&quot;,
    </p>
    <p>
      &nbsp;&nbsp;&nbsp;&nbsp;&nbsp;&nbsp;&nbsp;&nbsp;font : new Font(&quot;Agency FB&quot;, Font.BOLD, 64),
    </p>
    <p>
      &nbsp;&nbsp;&nbsp;&nbsp;&nbsp;&nbsp;&nbsp;&nbsp;foreground: Color.magenta,
    </p>
    <p>
      &nbsp;&nbsp;&nbsp;&nbsp;)
    </p>
    <p>
      }
    </p>
    <p>
      &nbsp;&nbsp;&nbsp;&nbsp;
    </p>
    <p>
      
    </p>
    <p>
      
    </p>
    <p>
      tabPane.addTab('Tutorial', panel)
    </p>
  </body>
</html></richcontent>
<richcontent CONTENT-TYPE="xml/" TYPE="DETAILS">
<html>
  <head>
    
  </head>
  <body>
    <p>
      .groovy
    </p>
  </body>
</html></richcontent>
</node>
</node>
<node TEXT="descartado" FOLDED="true" ID="ID_342909155"><richcontent CONTENT-TYPE="xml/" TYPE="DETAILS">
<html>
  <head>
    
  </head>
  <body>
    <p>
      discardedTask
    </p>
  </body>
</html></richcontent>
<node TEXT="cambiar ancho de Tabbed Pannel" ID="ID_1758313692"><richcontent TYPE="NOTE" CONTENT-TYPE="xml/">
<html>
  <head>
    
  </head>
  <body>
    <p>
      import org.freeplane.plugin.script.FreeplaneScriptBaseClass.ConfigProperties
    </p>
    <p>
      
    </p>
    <p>
      ConfigProperties config = new ConfigProperties()
    </p>
    <p>
      String&nbsp;&nbsp;panelSizeProperty = 'styleScrollPaneVisible.size'
    </p>
    <p>
      def lastSize = config.getIntProperty(panelSizeProperty)
    </p>
    <p>
      
    </p>
    <p>
      //return lastSize
    </p>
    <p>
      
    </p>
    <p>
      def tabPane = ui.freeplaneTabbedPanel
    </p>
    <p>
      
    </p>
    <p>
      //tabPane.width = 500&nbsp;&nbsp;// &lt;-- no funciona, es read only
    </p>
  </body>
</html></richcontent>
<richcontent CONTENT-TYPE="xml/" TYPE="DETAILS">
<html>
  <head>
    
  </head>
  <body>
    <p>
      .groovy
    </p>
  </body>
</html></richcontent>
</node>
</node>
</node>
<node TEXT="tests TabPane" FOLDED="true" ID="ID_1853958363">
<node TEXT="agregar tab Tutorial" ID="ID_112539979"><richcontent CONTENT-TYPE="xml/" TYPE="DETAILS">
<html>
  <head>
    
  </head>
  <body>
    <p>
      .groovy
    </p>
  </body>
</html></richcontent>
<richcontent TYPE="NOTE" CONTENT-TYPE="xml/">
<html>
  <head>
    
  </head>
  <body>
    <p>
      import edofro.tutorialomatic.TabPane
    </p>
    <p>
      
    </p>
    <p>
      
    </p>
    <p>
      // crear panel
    </p>
    <p>
      import groovy.swing.SwingBuilder
    </p>
    <p>
      import java.awt.Color
    </p>
    <p>
      import java.awt.Font
    </p>
    <p>
      SwingBuilder swing = new SwingBuilder()
    </p>
    <p>
      def panel = swing.panel(){
    </p>
    <p>
      &nbsp;&nbsp;&nbsp;&nbsp;label(
    </p>
    <p>
      &nbsp;&nbsp;&nbsp;&nbsp;&nbsp;&nbsp;&nbsp;&nbsp;text : &quot;Hola, hola&quot;,
    </p>
    <p>
      &nbsp;&nbsp;&nbsp;&nbsp;&nbsp;&nbsp;&nbsp;&nbsp;font : new Font(&quot;Agency FB&quot;, Font.BOLD, 64),
    </p>
    <p>
      &nbsp;&nbsp;&nbsp;&nbsp;&nbsp;&nbsp;&nbsp;&nbsp;foreground: Color.magenta,
    </p>
    <p>
      &nbsp;&nbsp;&nbsp;&nbsp;)
    </p>
    <p>
      }
    </p>
    <p>
      
    </p>
    <p>
      
    </p>
    <p>
      
    </p>
    <p>
      TabPane.addTab('Tutorial', panel)
    </p>
  </body>
</html></richcontent>
</node>
<node TEXT="eliminar tab tutorial" ID="ID_1761460802"><richcontent TYPE="NOTE" CONTENT-TYPE="xml/">
<html>
  <head>
    
  </head>
  <body>
    <p>
      import edofro.tutorialomatic.TabPane
    </p>
    <p>
      
    </p>
    <p>
      
    </p>
    <p>
      TabPane.removeTab('Tutorial')
    </p>
  </body>
</html></richcontent>
<richcontent CONTENT-TYPE="xml/" TYPE="DETAILS">
<html>
  <head>
    
  </head>
  <body>
    <p>
      .groovy
    </p>
  </body>
</html></richcontent>
</node>
<node TEXT="hacer visible tab tutorial" ID="ID_914736270"><richcontent TYPE="NOTE" CONTENT-TYPE="xml/">
<html>
  <head>
    
  </head>
  <body>
    <p>
      import edofro.tutorialomatic.TabPane
    </p>
    <p>
      
    </p>
    <p>
      
    </p>
    <p>
      TabPane.showTab('Tutorial')
    </p>
  </body>
</html></richcontent>
<richcontent CONTENT-TYPE="xml/" TYPE="DETAILS">
<html>
  <head>
    
  </head>
  <body>
    <p>
      .groovy
    </p>
  </body>
</html></richcontent>
</node>
</node>
</node>
<node TEXT="ToM_actions.groovy" FOLDED="true" ID="ID_974445068" LINK="file:/C:/Users/Edo/Documents/GitHub/Freeplane_Tutorial_AddOn/Tutorial-o-Matic/src/main/groovy/ToM_actions.groovy">
<attribute NAME="lastModifiedTime" VALUE="29-11-21 11:23" OBJECT="org.freeplane.features.format.FormattedDate|2021-11-29T11:23-0300|dd-MM-yy HH:mm"/>
<attribute NAME="lastAccessTime" VALUE="20-03-22 22:33" OBJECT="org.freeplane.features.format.FormattedDate|2022-03-20T22:33-0300|dd-MM-yy HH:mm"/>
<attribute NAME="creationTime" VALUE="12-09-21 17:06" OBJECT="org.freeplane.features.format.FormattedDate|2021-09-12T17:06-0300|datetime"/>
<attribute NAME="fileSize" VALUE="9.883" OBJECT="org.freeplane.features.format.FormattedNumber|9883|#,##0"/>
<attribute NAME="projectCode" VALUE="ToM_actions.grvy"/>
<richcontent TYPE="NOTE" CONTENT-TYPE="xml/">
<html>
  <head>
    
  </head>
  <body>
    <p>
      package edofro.tutorialomatic
    </p>
    <p>
      
    </p>
    <p>
      //import edofro.tutorialomatic.ToM_ui
    </p>
    <p>
      
    </p>
    <p>
      import org.freeplane.api.Node&nbsp;&nbsp;&nbsp;&nbsp;&nbsp;&nbsp;&nbsp;&nbsp;&nbsp;&nbsp;&nbsp;&nbsp;&nbsp;&nbsp;&nbsp;&nbsp;&nbsp;&nbsp;&nbsp;&nbsp;&nbsp;&nbsp;&nbsp;&nbsp;&nbsp;&nbsp;&nbsp;as ApiNode
    </p>
    <p>
      import org.freeplane.core.ui.components.UITools&nbsp;&nbsp;&nbsp;&nbsp;&nbsp;&nbsp;&nbsp;&nbsp;&nbsp;as ui
    </p>
    <p>
      import org.freeplane.core.util.MenuUtils&nbsp;&nbsp;&nbsp;&nbsp;&nbsp;&nbsp;&nbsp;&nbsp;&nbsp;&nbsp;&nbsp;&nbsp;&nbsp;&nbsp;&nbsp;&nbsp;as menuUtils
    </p>
    <p>
      import org.freeplane.core.util.TextUtils&nbsp;&nbsp;&nbsp;&nbsp;&nbsp;&nbsp;&nbsp;&nbsp;&nbsp;&nbsp;&nbsp;&nbsp;&nbsp;&nbsp;&nbsp;&nbsp;as textUtils
    </p>
    <p>
      import org.freeplane.core.util.HtmlUtils&nbsp;&nbsp;&nbsp;&nbsp;&nbsp;&nbsp;&nbsp;&nbsp;&nbsp;&nbsp;&nbsp;&nbsp;&nbsp;&nbsp;&nbsp;&nbsp;as htmlUtils
    </p>
    <p>
      import org.freeplane.plugin.script.proxy.ScriptUtils
    </p>
    <p>
      
    </p>
    <p>
      class ToM_actions{
    </p>
    <p>
      &nbsp;&nbsp;&nbsp;&nbsp;// region: definitions
    </p>
    <p>
      
    </p>
    <p>
      &nbsp;&nbsp;&nbsp;&nbsp;static final c = ScriptUtils.c()
    </p>
    <p>
      &nbsp;&nbsp;&nbsp;&nbsp;static final name = 'tutorialOMatic'
    </p>
    <p>
      &nbsp;&nbsp;&nbsp;&nbsp;static final actionInstruction1 = &quot;addons.${name}.ActionInstruction1&quot;
    </p>
    <p>
      &nbsp;&nbsp;&nbsp;&nbsp;static final actionInstruction2 = &quot;addons.${name}.ActionInstruction2&quot;
    </p>
    <p>
      &nbsp;&nbsp;&nbsp;&nbsp;static final enum ex{ muted, showHotKeys, showMenu }
    </p>
    <p>
      &nbsp;&nbsp;&nbsp;&nbsp;static final int pausa = 400
    </p>
    <p>
      
    </p>
    <p>
      &nbsp;&nbsp;&nbsp;&nbsp;static boolean waiting = false
    </p>
    <p>
      
    </p>
    <p>
      
    </p>
    <p>
      &nbsp;&nbsp;&nbsp;&nbsp;// end: definitions
    </p>
    <p>
      
    </p>
    <p>
      
    </p>
    <p>
      &nbsp;&nbsp;&nbsp;&nbsp;// ----------------- Methods -------------------------------------
    </p>
    <p>
      
    </p>
    <p>
      &nbsp;&nbsp;&nbsp;&nbsp;// region: execute actions
    </p>
    <p>
      &nbsp;&nbsp;&nbsp;&nbsp;&nbsp;&nbsp;&nbsp;&nbsp;//methods to execute actions showing (or not) menu commands or hotkeys related to action
    </p>
    <p>
      
    </p>
    <p>
      &nbsp;&nbsp;&nbsp;&nbsp;def static execute(String accion){
    </p>
    <p>
      &nbsp;&nbsp;&nbsp;&nbsp;&nbsp;&nbsp;&nbsp;&nbsp;def acciones =[] + accion
    </p>
    <p>
      &nbsp;&nbsp;&nbsp;&nbsp;&nbsp;&nbsp;&nbsp;&nbsp;execute(acciones)
    </p>
    <p>
      &nbsp;&nbsp;&nbsp;&nbsp;}
    </p>
    <p>
      
    </p>
    <p>
      &nbsp;&nbsp;&nbsp;&nbsp;def static execute(java.util.ArrayList acciones){
    </p>
    <p>
      &nbsp;&nbsp;&nbsp;&nbsp;&nbsp;&nbsp;&nbsp;&nbsp;menuUtils.executeMenuItems(acciones)
    </p>
    <p>
      &nbsp;&nbsp;&nbsp;&nbsp;}
    </p>
    <p>
      
    </p>
    <p>
      &nbsp;&nbsp;&nbsp;&nbsp;def static executeAction(infoAccion , how){
    </p>
    <p>
      &nbsp;&nbsp;&nbsp;&nbsp;&nbsp;&nbsp;&nbsp;&nbsp;waiting = true
    </p>
    <p>
      &nbsp;&nbsp;&nbsp;&nbsp;&nbsp;&nbsp;&nbsp;&nbsp;def timer = new Timer()
    </p>
    <p>
      &nbsp;&nbsp;&nbsp;&nbsp;&nbsp;&nbsp;&nbsp;&nbsp;c.statusInfo = &quot; ToM: Executing '${infoAccion.label}' &quot;
    </p>
    <p>
      &nbsp;&nbsp;&nbsp;&nbsp;&nbsp;&nbsp;&nbsp;&nbsp;switch(how){
    </p>
    <p>
      &nbsp;&nbsp;&nbsp;&nbsp;&nbsp;&nbsp;&nbsp;&nbsp;&nbsp;&nbsp;&nbsp;&nbsp;case ex.muted&nbsp;&nbsp;&nbsp;&nbsp;&nbsp;&nbsp;&nbsp;:
    </p>
    <p>
      &nbsp;&nbsp;&nbsp;&nbsp;&nbsp;&nbsp;&nbsp;&nbsp;&nbsp;&nbsp;&nbsp;&nbsp;&nbsp;&nbsp;&nbsp;&nbsp;execute(infoAccion.action)
    </p>
    <p>
      &nbsp;&nbsp;&nbsp;&nbsp;&nbsp;&nbsp;&nbsp;&nbsp;&nbsp;&nbsp;&nbsp;&nbsp;&nbsp;&nbsp;&nbsp;&nbsp;waiting = false
    </p>
    <p>
      &nbsp;&nbsp;&nbsp;&nbsp;&nbsp;&nbsp;&nbsp;&nbsp;&nbsp;&nbsp;&nbsp;&nbsp;&nbsp;&nbsp;&nbsp;&nbsp;break
    </p>
    <p>
      &nbsp;&nbsp;&nbsp;&nbsp;&nbsp;&nbsp;&nbsp;&nbsp;&nbsp;&nbsp;&nbsp;&nbsp;case ex.showHotKeys :
    </p>
    <p>
      &nbsp;&nbsp;&nbsp;&nbsp;&nbsp;&nbsp;&nbsp;&nbsp;&nbsp;&nbsp;&nbsp;&nbsp;&nbsp;&nbsp;&nbsp;&nbsp;//looks if it has defined hotKeys
    </p>
    <p>
      &nbsp;&nbsp;&nbsp;&nbsp;&nbsp;&nbsp;&nbsp;&nbsp;&nbsp;&nbsp;&nbsp;&nbsp;&nbsp;&nbsp;&nbsp;&nbsp;if(infoAccion.keyStroke){
    </p>
    <p>
      &nbsp;&nbsp;&nbsp;&nbsp;&nbsp;&nbsp;&nbsp;&nbsp;&nbsp;&nbsp;&nbsp;&nbsp;&nbsp;&nbsp;&nbsp;&nbsp;&nbsp;&nbsp;&nbsp;&nbsp;def msgDisplayTime = 1000
    </p>
    <p>
      &nbsp;&nbsp;&nbsp;&nbsp;&nbsp;&nbsp;&nbsp;&nbsp;&nbsp;&nbsp;&nbsp;&nbsp;&nbsp;&nbsp;&nbsp;&nbsp;&nbsp;&nbsp;&nbsp;&nbsp;ToM_ui.showTextMessage(&quot;${infoAccion.keyStroke} : ${infoAccion.label}&quot;.toString(),msgDisplayTime)
    </p>
    <p>
      &nbsp;&nbsp;&nbsp;&nbsp;&nbsp;&nbsp;&nbsp;&nbsp;&nbsp;&nbsp;&nbsp;&nbsp;&nbsp;&nbsp;&nbsp;&nbsp;&nbsp;&nbsp;&nbsp;&nbsp;execute(infoAccion.action)
    </p>
    <p>
      &nbsp;&nbsp;&nbsp;&nbsp;&nbsp;&nbsp;&nbsp;&nbsp;&nbsp;&nbsp;&nbsp;&nbsp;&nbsp;&nbsp;&nbsp;&nbsp;&nbsp;&nbsp;&nbsp;&nbsp;timer.runAfter(msgDisplayTime + 50){
    </p>
    <p>
      &nbsp;&nbsp;&nbsp;&nbsp;&nbsp;&nbsp;&nbsp;&nbsp;&nbsp;&nbsp;&nbsp;&nbsp;&nbsp;&nbsp;&nbsp;&nbsp;&nbsp;&nbsp;&nbsp;&nbsp;&nbsp;&nbsp;&nbsp;&nbsp;waiting = false
    </p>
    <p>
      &nbsp;&nbsp;&nbsp;&nbsp;&nbsp;&nbsp;&nbsp;&nbsp;&nbsp;&nbsp;&nbsp;&nbsp;&nbsp;&nbsp;&nbsp;&nbsp;&nbsp;&nbsp;&nbsp;&nbsp;}
    </p>
    <p>
      &nbsp;&nbsp;&nbsp;&nbsp;&nbsp;&nbsp;&nbsp;&nbsp;&nbsp;&nbsp;&nbsp;&nbsp;&nbsp;&nbsp;&nbsp;&nbsp;&nbsp;&nbsp;&nbsp;&nbsp;break // break is here, because if the action has not defined Hotkeys then it should show the menu way
    </p>
    <p>
      &nbsp;&nbsp;&nbsp;&nbsp;&nbsp;&nbsp;&nbsp;&nbsp;&nbsp;&nbsp;&nbsp;&nbsp;&nbsp;&nbsp;&nbsp;&nbsp;}
    </p>
    <p>
      &nbsp;&nbsp;&nbsp;&nbsp;&nbsp;&nbsp;&nbsp;&nbsp;&nbsp;&nbsp;&nbsp;&nbsp;case ex.showMenu&nbsp;&nbsp;&nbsp;&nbsp;:
    </p>
    <p>
      &nbsp;&nbsp;&nbsp;&nbsp;&nbsp;&nbsp;&nbsp;&nbsp;&nbsp;&nbsp;&nbsp;&nbsp;&nbsp;&nbsp;&nbsp;&nbsp;closeMenus(infoAccion.action)
    </p>
    <p>
      &nbsp;&nbsp;&nbsp;&nbsp;&nbsp;&nbsp;&nbsp;&nbsp;&nbsp;&nbsp;&nbsp;&nbsp;&nbsp;&nbsp;&nbsp;&nbsp;openMenus(infoAccion.action, pausa)
    </p>
    <p>
      &nbsp;&nbsp;&nbsp;&nbsp;&nbsp;&nbsp;&nbsp;&nbsp;&nbsp;&nbsp;&nbsp;&nbsp;&nbsp;&nbsp;&nbsp;&nbsp;def espera = (infoAccion.path.size()*2)*pausa
    </p>
    <p>
      &nbsp;&nbsp;&nbsp;&nbsp;&nbsp;&nbsp;&nbsp;&nbsp;&nbsp;&nbsp;&nbsp;&nbsp;&nbsp;&nbsp;&nbsp;&nbsp;timer.runAfter(espera){
    </p>
    <p>
      &nbsp;&nbsp;&nbsp;&nbsp;&nbsp;&nbsp;&nbsp;&nbsp;&nbsp;&nbsp;&nbsp;&nbsp;&nbsp;&nbsp;&nbsp;&nbsp;&nbsp;&nbsp;&nbsp;&nbsp;execute(infoAccion.action)
    </p>
    <p>
      &nbsp;&nbsp;&nbsp;&nbsp;&nbsp;&nbsp;&nbsp;&nbsp;&nbsp;&nbsp;&nbsp;&nbsp;&nbsp;&nbsp;&nbsp;&nbsp;&nbsp;&nbsp;&nbsp;&nbsp;closeMenus(infoAccion.action)
    </p>
    <p>
      &nbsp;&nbsp;&nbsp;&nbsp;&nbsp;&nbsp;&nbsp;&nbsp;&nbsp;&nbsp;&nbsp;&nbsp;&nbsp;&nbsp;&nbsp;&nbsp;&nbsp;&nbsp;&nbsp;&nbsp;waiting = false
    </p>
    <p>
      &nbsp;&nbsp;&nbsp;&nbsp;&nbsp;&nbsp;&nbsp;&nbsp;&nbsp;&nbsp;&nbsp;&nbsp;&nbsp;&nbsp;&nbsp;&nbsp;}
    </p>
    <p>
      &nbsp;&nbsp;&nbsp;&nbsp;&nbsp;&nbsp;&nbsp;&nbsp;&nbsp;&nbsp;&nbsp;&nbsp;&nbsp;&nbsp;&nbsp;&nbsp;break
    </p>
    <p>
      &nbsp;&nbsp;&nbsp;&nbsp;&nbsp;&nbsp;&nbsp;&nbsp;}
    </p>
    <p>
      &nbsp;&nbsp;&nbsp;&nbsp;}
    </p>
    <p>
      
    </p>
    <p>
      &nbsp;&nbsp;&nbsp;&nbsp;def static executeActions(infoAccions , how){
    </p>
    <p>
      &nbsp;&nbsp;&nbsp;&nbsp;&nbsp;&nbsp;&nbsp;&nbsp;if(infoAccions){
    </p>
    <p>
      &nbsp;&nbsp;&nbsp;&nbsp;&nbsp;&nbsp;&nbsp;&nbsp;&nbsp;&nbsp;&nbsp;&nbsp;if(!waiting){
    </p>
    <p>
      &nbsp;&nbsp;&nbsp;&nbsp;&nbsp;&nbsp;&nbsp;&nbsp;&nbsp;&nbsp;&nbsp;&nbsp;&nbsp;&nbsp;&nbsp;&nbsp;def infoAccion = infoAccions[0]
    </p>
    <p>
      &nbsp;&nbsp;&nbsp;&nbsp;&nbsp;&nbsp;&nbsp;&nbsp;&nbsp;&nbsp;&nbsp;&nbsp;&nbsp;&nbsp;&nbsp;&nbsp;executeAction(infoAccion , how)
    </p>
    <p>
      &nbsp;&nbsp;&nbsp;&nbsp;&nbsp;&nbsp;&nbsp;&nbsp;&nbsp;&nbsp;&nbsp;&nbsp;&nbsp;&nbsp;&nbsp;&nbsp;executeActions(infoAccions.drop(1) , how)
    </p>
    <p>
      &nbsp;&nbsp;&nbsp;&nbsp;&nbsp;&nbsp;&nbsp;&nbsp;&nbsp;&nbsp;&nbsp;&nbsp;} else {
    </p>
    <p>
      &nbsp;&nbsp;&nbsp;&nbsp;&nbsp;&nbsp;&nbsp;&nbsp;&nbsp;&nbsp;&nbsp;&nbsp;&nbsp;&nbsp;&nbsp;&nbsp;def timer = new Timer()
    </p>
    <p>
      &nbsp;&nbsp;&nbsp;&nbsp;&nbsp;&nbsp;&nbsp;&nbsp;&nbsp;&nbsp;&nbsp;&nbsp;&nbsp;&nbsp;&nbsp;&nbsp;timer.runAfter(200){
    </p>
    <p>
      &nbsp;&nbsp;&nbsp;&nbsp;&nbsp;&nbsp;&nbsp;&nbsp;&nbsp;&nbsp;&nbsp;&nbsp;&nbsp;&nbsp;&nbsp;&nbsp;&nbsp;&nbsp;&nbsp;&nbsp;executeActions(infoAccions , how)
    </p>
    <p>
      &nbsp;&nbsp;&nbsp;&nbsp;&nbsp;&nbsp;&nbsp;&nbsp;&nbsp;&nbsp;&nbsp;&nbsp;&nbsp;&nbsp;&nbsp;&nbsp;}
    </p>
    <p>
      &nbsp;&nbsp;&nbsp;&nbsp;&nbsp;&nbsp;&nbsp;&nbsp;&nbsp;&nbsp;&nbsp;&nbsp;}
    </p>
    <p>
      &nbsp;&nbsp;&nbsp;&nbsp;&nbsp;&nbsp;&nbsp;&nbsp;} else {
    </p>
    <p>
      &nbsp;&nbsp;&nbsp;&nbsp;&nbsp;&nbsp;&nbsp;&nbsp;&nbsp;&nbsp;&nbsp;&nbsp;if(!waiting){
    </p>
    <p>
      &nbsp;&nbsp;&nbsp;&nbsp;&nbsp;&nbsp;&nbsp;&nbsp;&nbsp;&nbsp;&nbsp;&nbsp;&nbsp;&nbsp;&nbsp;&nbsp;c.statusInfo = &quot; ToM: Ready!! &quot;
    </p>
    <p>
      &nbsp;&nbsp;&nbsp;&nbsp;&nbsp;&nbsp;&nbsp;&nbsp;&nbsp;&nbsp;&nbsp;&nbsp;} else {
    </p>
    <p>
      &nbsp;&nbsp;&nbsp;&nbsp;&nbsp;&nbsp;&nbsp;&nbsp;&nbsp;&nbsp;&nbsp;&nbsp;&nbsp;&nbsp;&nbsp;&nbsp;def timer = new Timer()
    </p>
    <p>
      &nbsp;&nbsp;&nbsp;&nbsp;&nbsp;&nbsp;&nbsp;&nbsp;&nbsp;&nbsp;&nbsp;&nbsp;&nbsp;&nbsp;&nbsp;&nbsp;timer.runAfter(200){
    </p>
    <p>
      &nbsp;&nbsp;&nbsp;&nbsp;&nbsp;&nbsp;&nbsp;&nbsp;&nbsp;&nbsp;&nbsp;&nbsp;&nbsp;&nbsp;&nbsp;&nbsp;&nbsp;&nbsp;&nbsp;&nbsp;executeActions(infoAccions , how)
    </p>
    <p>
      &nbsp;&nbsp;&nbsp;&nbsp;&nbsp;&nbsp;&nbsp;&nbsp;&nbsp;&nbsp;&nbsp;&nbsp;&nbsp;&nbsp;&nbsp;&nbsp;}
    </p>
    <p>
      &nbsp;&nbsp;&nbsp;&nbsp;&nbsp;&nbsp;&nbsp;&nbsp;&nbsp;&nbsp;&nbsp;&nbsp;}
    </p>
    <p>
      &nbsp;&nbsp;&nbsp;&nbsp;&nbsp;&nbsp;&nbsp;&nbsp;}
    </p>
    <p>
      &nbsp;&nbsp;&nbsp;&nbsp;}
    </p>
    <p>
      
    </p>
    <p>
      &nbsp;&nbsp;&nbsp;&nbsp;// end:
    </p>
    <p>
      
    </p>
    <p>
      &nbsp;&nbsp;&nbsp;&nbsp;// region: getting label / keyStroke / toolTipText from menuEntry
    </p>
    <p>
      &nbsp;&nbsp;&nbsp;&nbsp;&nbsp;&nbsp;&nbsp;&nbsp;//getting info from menuEntry
    </p>
    <p>
      
    </p>
    <p>
      &nbsp;&nbsp;&nbsp;&nbsp;def static getKeyStroke(myMenuEntry){
    </p>
    <p>
      &nbsp;&nbsp;&nbsp;&nbsp;&nbsp;&nbsp;&nbsp;&nbsp;def kS = myMenuEntry.keyStroke
    </p>
    <p>
      &nbsp;&nbsp;&nbsp;&nbsp;&nbsp;&nbsp;&nbsp;&nbsp;return kS?menuUtils.formatKeyStroke(kS).replace('+',' + '):null
    </p>
    <p>
      &nbsp;&nbsp;&nbsp;&nbsp;}
    </p>
    <p>
      
    </p>
    <p>
      &nbsp;&nbsp;&nbsp;&nbsp;def static getLabel(mME){
    </p>
    <p>
      &nbsp;&nbsp;&nbsp;&nbsp;&nbsp;&nbsp;&nbsp;&nbsp;mME.label
    </p>
    <p>
      &nbsp;&nbsp;&nbsp;&nbsp;}
    </p>
    <p>
      
    </p>
    <p>
      &nbsp;&nbsp;&nbsp;&nbsp;def static getToolTip(mME){
    </p>
    <p>
      &nbsp;&nbsp;&nbsp;&nbsp;&nbsp;&nbsp;&nbsp;&nbsp;mME.toolTipText
    </p>
    <p>
      &nbsp;&nbsp;&nbsp;&nbsp;}
    </p>
    <p>
      
    </p>
    <p>
      &nbsp;&nbsp;&nbsp;&nbsp;def static getMenuPath(path){
    </p>
    <p>
      &nbsp;&nbsp;&nbsp;&nbsp;&nbsp;&nbsp;&nbsp;&nbsp;path[1..-2]*.label.join(&quot;'-&gt;'&quot;)
    </p>
    <p>
      &nbsp;&nbsp;&nbsp;&nbsp;}
    </p>
    <p>
      
    </p>
    <p>
      &nbsp;&nbsp;&nbsp;&nbsp;// end:
    </p>
    <p>
      
    </p>
    <p>
      &nbsp;&nbsp;&nbsp;&nbsp;// region: getting information for action
    </p>
    <p>
      &nbsp;&nbsp;&nbsp;&nbsp;&nbsp;&nbsp;&nbsp;&nbsp;// building a map [:] for each action with its information
    </p>
    <p>
      
    </p>
    <p>
      &nbsp;&nbsp;&nbsp;&nbsp;def static getActionInfoMap(ApiNode nodo){
    </p>
    <p>
      &nbsp;&nbsp;&nbsp;&nbsp;&nbsp;&nbsp;&nbsp;&nbsp;def accion = action(nodo)
    </p>
    <p>
      &nbsp;&nbsp;&nbsp;&nbsp;&nbsp;&nbsp;&nbsp;&nbsp;getActionInfoMap(accion)
    </p>
    <p>
      &nbsp;&nbsp;&nbsp;&nbsp;}
    </p>
    <p>
      
    </p>
    <p>
      &nbsp;&nbsp;&nbsp;&nbsp;def static getActionInfoMap(String accion){
    </p>
    <p>
      &nbsp;&nbsp;&nbsp;&nbsp;&nbsp;&nbsp;&nbsp;&nbsp;def miPath&nbsp;&nbsp;&nbsp;&nbsp;= getMenuEntryPath(accion)
    </p>
    <p>
      &nbsp;&nbsp;&nbsp;&nbsp;&nbsp;&nbsp;&nbsp;&nbsp;if (!miPath) { return null }
    </p>
    <p>
      &nbsp;&nbsp;&nbsp;&nbsp;&nbsp;&nbsp;&nbsp;&nbsp;Map myAction = [:]
    </p>
    <p>
      &nbsp;&nbsp;&nbsp;&nbsp;&nbsp;&nbsp;&nbsp;&nbsp;myAction
    </p>
    <p>
      &nbsp;&nbsp;&nbsp;&nbsp;&nbsp;&nbsp;&nbsp;&nbsp;&nbsp;&nbsp;&nbsp;&nbsp;&nbsp;&nbsp;&nbsp;&nbsp;&nbsp;&lt;&lt; [ action&nbsp;&nbsp;&nbsp;&nbsp;&nbsp;: accion&nbsp;&nbsp;&nbsp;&nbsp;&nbsp;&nbsp;&nbsp;&nbsp;&nbsp;&nbsp;&nbsp;&nbsp;&nbsp;&nbsp;&nbsp;&nbsp;&nbsp;&nbsp;&nbsp;&nbsp;&nbsp;&nbsp;&nbsp;&nbsp;]
    </p>
    <p>
      &nbsp;&nbsp;&nbsp;&nbsp;&nbsp;&nbsp;&nbsp;&nbsp;&nbsp;&nbsp;&nbsp;&nbsp;&nbsp;&nbsp;&nbsp;&nbsp;&nbsp;&lt;&lt; [ path&nbsp;&nbsp;&nbsp;&nbsp;&nbsp;&nbsp;&nbsp;: miPath&nbsp;&nbsp;&nbsp;&nbsp;&nbsp;&nbsp;&nbsp;&nbsp;&nbsp;&nbsp;&nbsp;&nbsp;&nbsp;&nbsp;&nbsp;&nbsp;&nbsp;&nbsp;&nbsp;&nbsp;&nbsp;&nbsp;&nbsp;&nbsp;]
    </p>
    <p>
      &nbsp;&nbsp;&nbsp;&nbsp;&nbsp;&nbsp;&nbsp;&nbsp;&nbsp;&nbsp;&nbsp;&nbsp;&nbsp;&nbsp;&nbsp;&nbsp;&nbsp;&lt;&lt; [ keyStroke&nbsp;&nbsp;: getKeyStroke(miPath[-1])&nbsp;&nbsp;&nbsp;&nbsp;&nbsp;&nbsp;]
    </p>
    <p>
      &nbsp;&nbsp;&nbsp;&nbsp;&nbsp;&nbsp;&nbsp;&nbsp;&nbsp;&nbsp;&nbsp;&nbsp;&nbsp;&nbsp;&nbsp;&nbsp;&nbsp;&lt;&lt; [ label&nbsp;&nbsp;&nbsp;&nbsp;&nbsp;&nbsp;: getLabel(miPath[-1])&nbsp;&nbsp;&nbsp;&nbsp;&nbsp;&nbsp;&nbsp;&nbsp;&nbsp;&nbsp;]
    </p>
    <p>
      &nbsp;&nbsp;&nbsp;&nbsp;&nbsp;&nbsp;&nbsp;&nbsp;&nbsp;&nbsp;&nbsp;&nbsp;&nbsp;&nbsp;&nbsp;&nbsp;&nbsp;&lt;&lt; [ menuPath&nbsp;&nbsp;&nbsp;: getMenuPath(miPath)&nbsp;&nbsp;&nbsp;&nbsp;&nbsp;&nbsp;&nbsp;&nbsp;&nbsp;&nbsp;&nbsp;]
    </p>
    <p>
      &nbsp;&nbsp;&nbsp;&nbsp;&nbsp;&nbsp;&nbsp;&nbsp;&nbsp;&nbsp;&nbsp;&nbsp;&nbsp;&nbsp;&nbsp;&nbsp;&nbsp;&lt;&lt; [ toolTip&nbsp;&nbsp;&nbsp;&nbsp;: getToolTip(miPath[-1])&nbsp;&nbsp;&nbsp;&nbsp;&nbsp;&nbsp;&nbsp;&nbsp;]
    </p>
    <p>
      &nbsp;&nbsp;&nbsp;&nbsp;&nbsp;&nbsp;&nbsp;&nbsp;def instr1&nbsp;&nbsp;&nbsp;&nbsp;= textUtils.format(actionInstruction1, apos(myAction.menuPath), apos(myAction.label))
    </p>
    <p>
      &nbsp;&nbsp;&nbsp;&nbsp;&nbsp;&nbsp;&nbsp;&nbsp;def instr2&nbsp;&nbsp;&nbsp;&nbsp;= myAction.keyStroke?textUtils.format(actionInstruction2, apos(myAction.keyStroke)):&quot;&quot;
    </p>
    <p>
      &nbsp;&nbsp;&nbsp;&nbsp;&nbsp;&nbsp;&nbsp;&nbsp;myAction &lt;&lt; [ instructions : instr2?htmlUtils.join(instr1,&quot;&quot;, instr2).replace('\n',''):instr1 ]
    </p>
    <p>
      &nbsp;&nbsp;&nbsp;&nbsp;&nbsp;&nbsp;&nbsp;&nbsp;return myAction
    </p>
    <p>
      &nbsp;&nbsp;&nbsp;&nbsp;}
    </p>
    <p>
      
    </p>
    <p>
      &nbsp;&nbsp;&nbsp;&nbsp;def static apos(String texto){
    </p>
    <p>
      &nbsp;&nbsp;&nbsp;&nbsp;&nbsp;&nbsp;&nbsp;&nbsp;return &quot;\'&quot; + texto + &quot;\'&quot;
    </p>
    <p>
      &nbsp;&nbsp;&nbsp;&nbsp;}
    </p>
    <p>
      
    </p>
    <p>
      &nbsp;&nbsp;&nbsp;&nbsp;// end:
    </p>
    <p>
      
    </p>
    <p>
      &nbsp;&nbsp;&nbsp;&nbsp;// region: getting actions from nodes
    </p>
    <p>
      &nbsp;&nbsp;&nbsp;&nbsp;&nbsp;&nbsp;&nbsp;&nbsp;//getting actions from nodes
    </p>
    <p>
      
    </p>
    <p>
      &nbsp;&nbsp;&nbsp;&nbsp;def static action(n){
    </p>
    <p>
      &nbsp;&nbsp;&nbsp;&nbsp;&nbsp;&nbsp;&nbsp;&nbsp;return (n.link?.uri?.scheme == 'menuitem')?n.link.uri.schemeSpecificPart.drop(1):null
    </p>
    <p>
      &nbsp;&nbsp;&nbsp;&nbsp;}
    </p>
    <p>
      
    </p>
    <p>
      &nbsp;&nbsp;&nbsp;&nbsp;def static hasAction(n){
    </p>
    <p>
      &nbsp;&nbsp;&nbsp;&nbsp;&nbsp;&nbsp;&nbsp;&nbsp;return (n.link?.uri?.scheme == 'menuitem')
    </p>
    <p>
      &nbsp;&nbsp;&nbsp;&nbsp;}
    </p>
    <p>
      
    </p>
    <p>
      &nbsp;&nbsp;&nbsp;&nbsp;// end:
    </p>
    <p>
      
    </p>
    <p>
      &nbsp;&nbsp;&nbsp;&nbsp;// region: getting MenuEntryTree
    </p>
    <p>
      &nbsp;&nbsp;&nbsp;&nbsp;&nbsp;&nbsp;&nbsp;&nbsp;// getting MenuEntryTree
    </p>
    <p>
      
    </p>
    <p>
      &nbsp;&nbsp;&nbsp;&nbsp;def static getMenuEntryPath(miAccion){
    </p>
    <p>
      &nbsp;&nbsp;&nbsp;&nbsp;&nbsp;&nbsp;&nbsp;&nbsp;return getMenuEntryPath(getMenuEntryTree(), miAccion)
    </p>
    <p>
      &nbsp;&nbsp;&nbsp;&nbsp;}
    </p>
    <p>
      
    </p>
    <p>
      &nbsp;&nbsp;&nbsp;&nbsp;def static getMenuEntryTree(){
    </p>
    <p>
      &nbsp;&nbsp;&nbsp;&nbsp;&nbsp;&nbsp;&nbsp;&nbsp;def menuName = &quot;main_menu&quot;
    </p>
    <p>
      &nbsp;&nbsp;&nbsp;&nbsp;&nbsp;&nbsp;&nbsp;&nbsp;//&nbsp;&nbsp;&nbsp;&nbsp;menuName = 'view'
    </p>
    <p>
      &nbsp;&nbsp;&nbsp;&nbsp;&nbsp;&nbsp;&nbsp;&nbsp;return menuUtils.createMenuEntryTree(menuName)
    </p>
    <p>
      &nbsp;&nbsp;&nbsp;&nbsp;}
    </p>
    <p>
      
    </p>
    <p>
      &nbsp;&nbsp;&nbsp;&nbsp;def static getMenuEntryPath(mTree, miAccion){
    </p>
    <p>
      &nbsp;&nbsp;&nbsp;&nbsp;&nbsp;&nbsp;&nbsp;&nbsp;def path
    </p>
    <p>
      
    </p>
    <p>
      &nbsp;&nbsp;&nbsp;&nbsp;&nbsp;&nbsp;&nbsp;&nbsp;// ver si hijos leaf contiene accion
    </p>
    <p>
      &nbsp;&nbsp;&nbsp;&nbsp;&nbsp;&nbsp;&nbsp;&nbsp;//def menuCommand = mTree.children.findAll{it.leaf}?.find{it.userObject.key == miAccion}&nbsp;&nbsp;&nbsp;&nbsp;&nbsp;//JAVA 8
    </p>
    <p>
      &nbsp;&nbsp;&nbsp;&nbsp;&nbsp;&nbsp;&nbsp;&nbsp;def menuCommand = mTree.children().findAll{it.leaf}?.find{it.userObject.key == miAccion} //JAVA 17
    </p>
    <p>
      &nbsp;&nbsp;&nbsp;&nbsp;&nbsp;&nbsp;&nbsp;&nbsp;// alguno?
    </p>
    <p>
      &nbsp;&nbsp;&nbsp;&nbsp;&nbsp;&nbsp;&nbsp;&nbsp;if (menuCommand){
    </p>
    <p>
      &nbsp;&nbsp;&nbsp;&nbsp;&nbsp;&nbsp;&nbsp;&nbsp;&nbsp;&nbsp;&nbsp;&nbsp;&nbsp;&nbsp;&nbsp;&nbsp;// devolver MenuEntry
    </p>
    <p>
      &nbsp;&nbsp;&nbsp;&nbsp;&nbsp;&nbsp;&nbsp;&nbsp;&nbsp;&nbsp;&nbsp;&nbsp;&nbsp;&nbsp;&nbsp;&nbsp;return [] + mTree.userObject&nbsp;&nbsp;+ menuCommand.userObject
    </p>
    <p>
      &nbsp;&nbsp;&nbsp;&nbsp;&nbsp;&nbsp;&nbsp;&nbsp;}
    </p>
    <p>
      
    </p>
    <p>
      &nbsp;&nbsp;&nbsp;&nbsp;&nbsp;&nbsp;&nbsp;&nbsp;// no
    </p>
    <p>
      &nbsp;&nbsp;&nbsp;&nbsp;&nbsp;&nbsp;&nbsp;&nbsp;&nbsp;&nbsp;&nbsp;&nbsp;// sacar lista hijos no leaf
    </p>
    <p>
      &nbsp;&nbsp;&nbsp;&nbsp;&nbsp;&nbsp;&nbsp;&nbsp;def hijosNoLeaf = mTree.children().findAll{!it.leaf}
    </p>
    <p>
      &nbsp;&nbsp;&nbsp;&nbsp;&nbsp;&nbsp;&nbsp;&nbsp;// si hay
    </p>
    <p>
      &nbsp;&nbsp;&nbsp;&nbsp;&nbsp;&nbsp;&nbsp;&nbsp;if (hijosNoLeaf){
    </p>
    <p>
      &nbsp;&nbsp;&nbsp;&nbsp;&nbsp;&nbsp;&nbsp;&nbsp;&nbsp;&nbsp;&nbsp;&nbsp;// recursivo
    </p>
    <p>
      &nbsp;&nbsp;&nbsp;&nbsp;&nbsp;&nbsp;&nbsp;&nbsp;&nbsp;&nbsp;&nbsp;&nbsp;hijosNoLeaf.each{ mT -&gt;
    </p>
    <p>
      &nbsp;&nbsp;&nbsp;&nbsp;&nbsp;&nbsp;&nbsp;&nbsp;&nbsp;&nbsp;&nbsp;&nbsp;&nbsp;&nbsp;&nbsp;&nbsp;if(!path){
    </p>
    <p>
      &nbsp;&nbsp;&nbsp;&nbsp;&nbsp;&nbsp;&nbsp;&nbsp;&nbsp;&nbsp;&nbsp;&nbsp;&nbsp;&nbsp;&nbsp;&nbsp;&nbsp;&nbsp;&nbsp;&nbsp;path = getMenuEntryPath(mT, miAccion)
    </p>
    <p>
      &nbsp;&nbsp;&nbsp;&nbsp;&nbsp;&nbsp;&nbsp;&nbsp;&nbsp;&nbsp;&nbsp;&nbsp;&nbsp;&nbsp;&nbsp;&nbsp;}
    </p>
    <p>
      &nbsp;&nbsp;&nbsp;&nbsp;&nbsp;&nbsp;&nbsp;&nbsp;&nbsp;&nbsp;&nbsp;&nbsp;}
    </p>
    <p>
      &nbsp;&nbsp;&nbsp;&nbsp;&nbsp;&nbsp;&nbsp;&nbsp;&nbsp;&nbsp;&nbsp;&nbsp;if(path){
    </p>
    <p>
      &nbsp;&nbsp;&nbsp;&nbsp;&nbsp;&nbsp;&nbsp;&nbsp;&nbsp;&nbsp;&nbsp;&nbsp;&nbsp;&nbsp;&nbsp;&nbsp;return [] + mTree.userObject&nbsp;&nbsp;+ path
    </p>
    <p>
      &nbsp;&nbsp;&nbsp;&nbsp;&nbsp;&nbsp;&nbsp;&nbsp;&nbsp;&nbsp;&nbsp;&nbsp;} else {
    </p>
    <p>
      &nbsp;&nbsp;&nbsp;&nbsp;&nbsp;&nbsp;&nbsp;&nbsp;&nbsp;&nbsp;&nbsp;&nbsp;&nbsp;&nbsp;&nbsp;&nbsp;return null
    </p>
    <p>
      &nbsp;&nbsp;&nbsp;&nbsp;&nbsp;&nbsp;&nbsp;&nbsp;&nbsp;&nbsp;&nbsp;&nbsp;}
    </p>
    <p>
      &nbsp;&nbsp;&nbsp;&nbsp;&nbsp;&nbsp;&nbsp;&nbsp;}
    </p>
    <p>
      &nbsp;&nbsp;&nbsp;&nbsp;&nbsp;&nbsp;&nbsp;&nbsp;// si no hay, devolver null
    </p>
    <p>
      &nbsp;&nbsp;&nbsp;&nbsp;&nbsp;&nbsp;&nbsp;&nbsp;return null
    </p>
    <p>
      &nbsp;&nbsp;&nbsp;&nbsp;}
    </p>
    <p>
      
    </p>
    <p>
      &nbsp;&nbsp;&nbsp;&nbsp;// end:
    </p>
    <p>
      
    </p>
    <p>
      &nbsp;&nbsp;&nbsp;&nbsp;// region: displaying submenus
    </p>
    <p>
      &nbsp;&nbsp;&nbsp;&nbsp;&nbsp;&nbsp;&nbsp;&nbsp;//methods for displaying submenus from menubar
    </p>
    <p>
      
    </p>
    <p>
      &nbsp;&nbsp;&nbsp;&nbsp;def static openMenus(accion, timeLapse){
    </p>
    <p>
      &nbsp;&nbsp;&nbsp;&nbsp;&nbsp;&nbsp;&nbsp;&nbsp;timeLapse = timeLapse&lt;25?25:timeLapse&gt;3000?3000:timeLapse
    </p>
    <p>
      &nbsp;&nbsp;&nbsp;&nbsp;&nbsp;&nbsp;&nbsp;&nbsp;def menuPath = getMenuEntryPath(accion).drop(1)*.label
    </p>
    <p>
      &nbsp;&nbsp;&nbsp;&nbsp;&nbsp;&nbsp;&nbsp;&nbsp;def subMenu = ui.frame.JMenuBar.components.find{it.text == menuPath[0]}
    </p>
    <p>
      &nbsp;&nbsp;&nbsp;&nbsp;&nbsp;&nbsp;&nbsp;&nbsp;subMenu.armed = true
    </p>
    <p>
      
    </p>
    <p>
      &nbsp;&nbsp;&nbsp;&nbsp;&nbsp;&nbsp;&nbsp;&nbsp;def timer = new Timer()
    </p>
    <p>
      &nbsp;&nbsp;&nbsp;&nbsp;&nbsp;&nbsp;&nbsp;&nbsp;menuPath.drop(1).eachWithIndex{menuItem, i -&gt;
    </p>
    <p>
      &nbsp;&nbsp;&nbsp;&nbsp;&nbsp;&nbsp;&nbsp;&nbsp;&nbsp;&nbsp;&nbsp;&nbsp;timer.runAfter(2 * (i + 1) * timeLapse) {
    </p>
    <p>
      &nbsp;&nbsp;&nbsp;&nbsp;&nbsp;&nbsp;&nbsp;&nbsp;&nbsp;&nbsp;&nbsp;&nbsp;&nbsp;&nbsp;&nbsp;&nbsp;if(subMenu instanceof javax.swing.JMenu){
    </p>
    <p>
      &nbsp;&nbsp;&nbsp;&nbsp;&nbsp;&nbsp;&nbsp;&nbsp;&nbsp;&nbsp;&nbsp;&nbsp;&nbsp;&nbsp;&nbsp;&nbsp;&nbsp;&nbsp;&nbsp;&nbsp;subMenu.popupMenuVisible = true
    </p>
    <p>
      &nbsp;&nbsp;&nbsp;&nbsp;&nbsp;&nbsp;&nbsp;&nbsp;&nbsp;&nbsp;&nbsp;&nbsp;&nbsp;&nbsp;&nbsp;&nbsp;&nbsp;&nbsp;&nbsp;&nbsp;def tempMenu = subMenu.menuComponents.find{it.hasProperty('text') &amp;&amp; it.text == menuItem}
    </p>
    <p>
      &nbsp;&nbsp;&nbsp;&nbsp;&nbsp;&nbsp;&nbsp;&nbsp;&nbsp;&nbsp;&nbsp;&nbsp;&nbsp;&nbsp;&nbsp;&nbsp;&nbsp;&nbsp;&nbsp;&nbsp;def max = 0
    </p>
    <p>
      &nbsp;&nbsp;&nbsp;&nbsp;&nbsp;&nbsp;&nbsp;&nbsp;&nbsp;&nbsp;&nbsp;&nbsp;&nbsp;&nbsp;&nbsp;&nbsp;&nbsp;&nbsp;&nbsp;&nbsp;while (!tempMenu &amp;&amp; max &lt;15) {
    </p>
    <p>
      &nbsp;&nbsp;&nbsp;&nbsp;&nbsp;&nbsp;&nbsp;&nbsp;&nbsp;&nbsp;&nbsp;&nbsp;&nbsp;&nbsp;&nbsp;&nbsp;&nbsp;&nbsp;&nbsp;&nbsp;&nbsp;&nbsp;&nbsp;&nbsp;subMenu = subMenu.menuComponents.find{it.hasProperty('text') &amp;&amp; it.text == ' '}
    </p>
    <p>
      &nbsp;&nbsp;&nbsp;&nbsp;&nbsp;&nbsp;&nbsp;&nbsp;&nbsp;&nbsp;&nbsp;&nbsp;&nbsp;&nbsp;&nbsp;&nbsp;&nbsp;&nbsp;&nbsp;&nbsp;&nbsp;&nbsp;&nbsp;&nbsp;subMenu.popupMenuVisible = true
    </p>
    <p>
      &nbsp;&nbsp;&nbsp;&nbsp;&nbsp;&nbsp;&nbsp;&nbsp;&nbsp;&nbsp;&nbsp;&nbsp;&nbsp;&nbsp;&nbsp;&nbsp;&nbsp;&nbsp;&nbsp;&nbsp;&nbsp;&nbsp;&nbsp;&nbsp;tempMenu = subMenu.menuComponents.find{it.hasProperty('text') &amp;&amp; it.text == menuItem}
    </p>
    <p>
      &nbsp;&nbsp;&nbsp;&nbsp;&nbsp;&nbsp;&nbsp;&nbsp;&nbsp;&nbsp;&nbsp;&nbsp;&nbsp;&nbsp;&nbsp;&nbsp;&nbsp;&nbsp;&nbsp;&nbsp;&nbsp;&nbsp;&nbsp;&nbsp;max++
    </p>
    <p>
      &nbsp;&nbsp;&nbsp;&nbsp;&nbsp;&nbsp;&nbsp;&nbsp;&nbsp;&nbsp;&nbsp;&nbsp;&nbsp;&nbsp;&nbsp;&nbsp;&nbsp;&nbsp;&nbsp;&nbsp;}
    </p>
    <p>
      &nbsp;&nbsp;&nbsp;&nbsp;&nbsp;&nbsp;&nbsp;&nbsp;&nbsp;&nbsp;&nbsp;&nbsp;&nbsp;&nbsp;&nbsp;&nbsp;&nbsp;&nbsp;&nbsp;&nbsp;subMenu = tempMenu
    </p>
    <p>
      &nbsp;&nbsp;&nbsp;&nbsp;&nbsp;&nbsp;&nbsp;&nbsp;&nbsp;&nbsp;&nbsp;&nbsp;&nbsp;&nbsp;&nbsp;&nbsp;}
    </p>
    <p>
      &nbsp;&nbsp;&nbsp;&nbsp;&nbsp;&nbsp;&nbsp;&nbsp;&nbsp;&nbsp;&nbsp;&nbsp;&nbsp;&nbsp;&nbsp;&nbsp;sleep(timeLapse)
    </p>
    <p>
      &nbsp;&nbsp;&nbsp;&nbsp;&nbsp;&nbsp;&nbsp;&nbsp;&nbsp;&nbsp;&nbsp;&nbsp;&nbsp;&nbsp;&nbsp;&nbsp;subMenu?.armed = true
    </p>
    <p>
      &nbsp;&nbsp;&nbsp;&nbsp;&nbsp;&nbsp;&nbsp;&nbsp;&nbsp;&nbsp;&nbsp;&nbsp;}
    </p>
    <p>
      &nbsp;&nbsp;&nbsp;&nbsp;&nbsp;&nbsp;&nbsp;&nbsp;}
    </p>
    <p>
      &nbsp;&nbsp;&nbsp;&nbsp;}
    </p>
    <p>
      
    </p>
    <p>
      &nbsp;&nbsp;&nbsp;&nbsp;def static closeMenus(accion){
    </p>
    <p>
      &nbsp;&nbsp;&nbsp;&nbsp;&nbsp;&nbsp;&nbsp;&nbsp;def componentes = getMenuComponents(accion)//.takeRight(2) // mod
    </p>
    <p>
      &nbsp;&nbsp;&nbsp;&nbsp;&nbsp;&nbsp;&nbsp;&nbsp;componentes.reverse().each{com -&gt;
    </p>
    <p>
      &nbsp;&nbsp;&nbsp;&nbsp;&nbsp;&nbsp;&nbsp;&nbsp;&nbsp;&nbsp;&nbsp;&nbsp;if(com instanceof javax.swing.JMenu){
    </p>
    <p>
      &nbsp;&nbsp;&nbsp;&nbsp;&nbsp;&nbsp;&nbsp;&nbsp;&nbsp;&nbsp;&nbsp;&nbsp;&nbsp;&nbsp;&nbsp;&nbsp;com.popupMenuVisible = false
    </p>
    <p>
      &nbsp;&nbsp;&nbsp;&nbsp;&nbsp;&nbsp;&nbsp;&nbsp;&nbsp;&nbsp;&nbsp;&nbsp;}
    </p>
    <p>
      &nbsp;&nbsp;&nbsp;&nbsp;&nbsp;&nbsp;&nbsp;&nbsp;&nbsp;&nbsp;&nbsp;&nbsp;com?.armed = false
    </p>
    <p>
      &nbsp;&nbsp;&nbsp;&nbsp;&nbsp;&nbsp;&nbsp;&nbsp;}
    </p>
    <p>
      &nbsp;&nbsp;&nbsp;&nbsp;}
    </p>
    <p>
      
    </p>
    <p>
      &nbsp;&nbsp;&nbsp;&nbsp;def static isMenuItemVisible(accion){
    </p>
    <p>
      &nbsp;&nbsp;&nbsp;&nbsp;&nbsp;&nbsp;&nbsp;&nbsp;def m = getMenuComponents(accion)[-1]
    </p>
    <p>
      &nbsp;&nbsp;&nbsp;&nbsp;&nbsp;&nbsp;&nbsp;&nbsp;return m &amp;&amp; m.showing // &amp;&amp; m.armed
    </p>
    <p>
      &nbsp;&nbsp;&nbsp;&nbsp;}
    </p>
    <p>
      
    </p>
    <p>
      &nbsp;&nbsp;&nbsp;&nbsp;def static getMenuComponents(accion){
    </p>
    <p>
      &nbsp;&nbsp;&nbsp;&nbsp;&nbsp;&nbsp;&nbsp;&nbsp;def menuPath = getMenuEntryPath(accion).drop(1)*.label
    </p>
    <p>
      &nbsp;&nbsp;&nbsp;&nbsp;&nbsp;&nbsp;&nbsp;&nbsp;def subMenu = ui.frame.JMenuBar.components.find{it.text == menuPath[0]}
    </p>
    <p>
      
    </p>
    <p>
      &nbsp;&nbsp;&nbsp;&nbsp;&nbsp;&nbsp;&nbsp;&nbsp;def componentes = [] + subMenu
    </p>
    <p>
      &nbsp;&nbsp;&nbsp;&nbsp;&nbsp;&nbsp;&nbsp;&nbsp;menuPath.drop(1).each{menuItem -&gt;
    </p>
    <p>
      &nbsp;&nbsp;&nbsp;&nbsp;&nbsp;&nbsp;&nbsp;&nbsp;&nbsp;&nbsp;&nbsp;&nbsp;subMenu = subMenu?.menuComponents.find{it.hasProperty('text') &amp;&amp; it.text == menuItem}
    </p>
    <p>
      &nbsp;&nbsp;&nbsp;&nbsp;&nbsp;&nbsp;&nbsp;&nbsp;&nbsp;&nbsp;&nbsp;&nbsp;componentes += subMenu
    </p>
    <p>
      &nbsp;&nbsp;&nbsp;&nbsp;&nbsp;&nbsp;&nbsp;&nbsp;}
    </p>
    <p>
      &nbsp;&nbsp;&nbsp;&nbsp;&nbsp;&nbsp;&nbsp;&nbsp;return componentes
    </p>
    <p>
      &nbsp;&nbsp;&nbsp;&nbsp;}
    </p>
    <p>
      
    </p>
    <p>
      &nbsp;&nbsp;&nbsp;&nbsp;// end:
    </p>
    <p>
      
    </p>
    <p>
      &nbsp;&nbsp;&nbsp;&nbsp;// region: working with nodes
    </p>
    <p>
      &nbsp;&nbsp;&nbsp;&nbsp;&nbsp;&nbsp;&nbsp;&nbsp;//TODO: WIP simulateTextInputInNode
    </p>
    <p>
      
    </p>
    <p>
      &nbsp;&nbsp;&nbsp;&nbsp;def static simulateTextInputInNode(nodo, texto, timeLapse, step){&nbsp;&nbsp;//TODO: find a way that doesn't fire listener until the end
    </p>
    <p>
      &nbsp;&nbsp;&nbsp;&nbsp;&nbsp;&nbsp;&nbsp;&nbsp;def timer = new Timer()
    </p>
    <p>
      &nbsp;&nbsp;&nbsp;&nbsp;&nbsp;&nbsp;&nbsp;&nbsp;c.select(nodo)&nbsp;&nbsp;&nbsp;&nbsp;&nbsp;&nbsp;&nbsp;&nbsp;&nbsp;&nbsp;&nbsp;&nbsp;&nbsp;&nbsp;//TODO: what if nodo is not visible?
    </p>
    <p>
      &nbsp;&nbsp;&nbsp;&nbsp;&nbsp;&nbsp;&nbsp;&nbsp;for(def i = 0 ; i &lt;= texto.size() + step; i += step){
    </p>
    <p>
      &nbsp;&nbsp;&nbsp;&nbsp;&nbsp;&nbsp;&nbsp;&nbsp;&nbsp;&nbsp;&nbsp;&nbsp;def subTexto = texto.take(i)
    </p>
    <p>
      &nbsp;&nbsp;&nbsp;&nbsp;&nbsp;&nbsp;&nbsp;&nbsp;&nbsp;&nbsp;&nbsp;&nbsp;timer.runAfter(i * timeLapse) {
    </p>
    <p>
      &nbsp;&nbsp;&nbsp;&nbsp;&nbsp;&nbsp;&nbsp;&nbsp;&nbsp;&nbsp;&nbsp;&nbsp;&nbsp;&nbsp;&nbsp;&nbsp;nodo.text = subTexto
    </p>
    <p>
      &nbsp;&nbsp;&nbsp;&nbsp;&nbsp;&nbsp;&nbsp;&nbsp;&nbsp;&nbsp;&nbsp;&nbsp;}
    </p>
    <p>
      &nbsp;&nbsp;&nbsp;&nbsp;&nbsp;&nbsp;&nbsp;&nbsp;}
    </p>
    <p>
      &nbsp;&nbsp;&nbsp;&nbsp;&nbsp;&nbsp;&nbsp;&nbsp;timer.runAfter((texto.size()/step * timeLapse) as int) {
    </p>
    <p>
      &nbsp;&nbsp;&nbsp;&nbsp;&nbsp;&nbsp;&nbsp;&nbsp;&nbsp;&nbsp;&nbsp;&nbsp;c.select(nodo)
    </p>
    <p>
      &nbsp;&nbsp;&nbsp;&nbsp;&nbsp;&nbsp;&nbsp;&nbsp;}
    </p>
    <p>
      &nbsp;&nbsp;&nbsp;&nbsp;}
    </p>
    <p>
      
    </p>
    <p>
      &nbsp;&nbsp;&nbsp;&nbsp;// end:
    </p>
    <p>
      
    </p>
    <p>
      &nbsp;&nbsp;&nbsp;&nbsp;// region:
    </p>
    <p>
      
    </p>
    <p>
      &nbsp;&nbsp;&nbsp;&nbsp;// end:
    </p>
    <p>
      
    </p>
    <p>
      &nbsp;&nbsp;&nbsp;&nbsp;// region:
    </p>
    <p>
      
    </p>
    <p>
      &nbsp;&nbsp;&nbsp;&nbsp;// end:
    </p>
    <p>
      
    </p>
    <p>
      }
    </p>
  </body>
</html>
</richcontent>
<node TEXT="tests" FOLDED="true" ID="ID_1250833748">
<node TEXT="tests ToM_actions" FOLDED="true" ID="ID_144232268" VGAP_QUANTITY="2 px">
<node TEXT="nodo tiene link a menu action" ID="ID_1137418963"><richcontent CONTENT-TYPE="xml/" TYPE="DETAILS">
<html>
  <head>
    
  </head>
  <body>
    <p>
      .groovy
    </p>
  </body>
</html></richcontent>
<richcontent TYPE="NOTE" CONTENT-TYPE="xml/">
<html>
  <head>
    
  </head>
  <body>
    <p>
      import edofro.tutorialomatic.ToM_actions as toma
    </p>
    <p>
      
    </p>
    <p>
      def n = node
    </p>
    <p>
      
    </p>
    <p>
      def resultado = toma.hasAction(n)
    </p>
    <p>
      
    </p>
    <p>
      ui.informationMessage(&quot;selected node has link to action? :&nbsp;&nbsp;$resultado&quot;.toString())
    </p>
  </body>
</html></richcontent>
</node>
<node TEXT="obtener string de accion de nodo" ID="ID_1393077049"><richcontent TYPE="NOTE" CONTENT-TYPE="xml/">
<html>
  <head>
    
  </head>
  <body>
    <p>
      import edofro.tutorialomatic.ToM_actions as toma
    </p>
    <p>
      
    </p>
    <p>
      def n = node
    </p>
    <p>
      
    </p>
    <p>
      def resultado = toma.action(n)
    </p>
    <p>
      
    </p>
    <p>
      ui.informationMessage(&quot;selected node has link to&nbsp;&nbsp;:&nbsp;&nbsp;&nbsp;$resultado&quot;.toString())
    </p>
  </body>
</html></richcontent>
<richcontent CONTENT-TYPE="xml/" TYPE="DETAILS">
<html>
  <head>
    
  </head>
  <body>
    <p>
      .groovy
    </p>
  </body>
</html></richcontent>
</node>
<node TEXT="test de varios puntos" ID="ID_794192290"><richcontent TYPE="NOTE" CONTENT-TYPE="xml/">
<html>
  <head>
    
  </head>
  <body>
    <p>
      import edofro.tutorialomatic.ToM_actions as toma
    </p>
    <p>
      
    </p>
    <p>
      def nodo = node
    </p>
    <p>
      
    </p>
    <p>
      if (!toma.hasAction(nodo)) return 'no link to menu action in selected node'
    </p>
    <p>
      
    </p>
    <p>
      def accion = toma.action(nodo)//.toString())
    </p>
    <p>
      
    </p>
    <p>
      // obtener path menuTree
    </p>
    <p>
      def miPath = toma.getMenuEntryPath(accion)
    </p>
    <p>
      
    </p>
    <p>
      ui.informationMessage(&quot;This is the menu path for action '$accion': \n\n&nbsp;&nbsp;&nbsp;$miPath \n&quot;.toString())
    </p>
    <p>
      ui.informationMessage(&quot;This is the keyStroke for action '$accion': \n\n&nbsp;&nbsp;&nbsp;'${toma.getKeyStroke(miPath[-1])}' \n&quot;.toString())
    </p>
    <p>
      ui.informationMessage(&quot;This is the label for action '$accion': \n\n&nbsp;&nbsp;&nbsp;'${toma.getLabel(miPath[-1])}' \n&quot;.toString())
    </p>
    <p>
      ui.informationMessage(&quot;This is the toolTip for action '$accion': \n\n&nbsp;&nbsp;&nbsp;'${toma.getToolTip(miPath[-1])}' \n&quot;.toString())
    </p>
    <p>
      ui.informationMessage(&quot;${toma.getActionInstructions(accion)}&quot;.toString())
    </p>
    <p>
      
    </p>
    <p>
      // nodo.createChild(accion).note = toma.getActionInstructions(accion)
    </p>
  </body>
</html></richcontent>
<richcontent CONTENT-TYPE="xml/" TYPE="DETAILS">
<html>
  <head>
    
  </head>
  <body>
    <p>
      .groovy
    </p>
  </body>
</html></richcontent>
</node>
<node TEXT="ejecutar accion" ID="ID_1788628038"><richcontent TYPE="NOTE" CONTENT-TYPE="xml/">
<html>
  <head>
    
  </head>
  <body>
    <p>
      import edofro.tutorialomatic.ToM_actions as toma
    </p>
    <p>
      
    </p>
    <p>
      def n = node
    </p>
    <p>
      
    </p>
    <p>
      def accion = toma.action(n)
    </p>
    <p>
      
    </p>
    <p>
      if (accion){
    </p>
    <p>
      &nbsp;&nbsp;&nbsp;&nbsp;toma.execute(accion)
    </p>
    <p>
      }
    </p>
  </body>
</html></richcontent>
<richcontent CONTENT-TYPE="xml/" TYPE="DETAILS">
<html>
  <head>
    
  </head>
  <body>
    <p>
      .groovy
    </p>
  </body>
</html></richcontent>
</node>
<node TEXT="ejecutar acciones" ID="ID_1511018833"><richcontent TYPE="NOTE" CONTENT-TYPE="xml/">
<html>
  <head>
    
  </head>
  <body>
    <p>
      import edofro.tutorialomatic.ToM_actions as toma
    </p>
    <p>
      
    </p>
    <p>
      def nodos = node.children
    </p>
    <p>
      
    </p>
    <p>
      def acciones = []
    </p>
    <p>
      nodos.each{n -&gt;
    </p>
    <p>
      &nbsp;&nbsp;&nbsp;&nbsp;acciones += toma.action(n)
    </p>
    <p>
      }
    </p>
    <p>
      
    </p>
    <p>
      // return acciones
    </p>
    <p>
      
    </p>
    <p>
      if (acciones){
    </p>
    <p>
      &nbsp;&nbsp;&nbsp;&nbsp;toma.execute(acciones)
    </p>
    <p>
      }
    </p>
  </body>
</html></richcontent>
<richcontent CONTENT-TYPE="xml/" TYPE="DETAILS">
<html>
  <head>
    
  </head>
  <body>
    <p>
      .groovy
    </p>
  </body>
</html></richcontent>
</node>
<node TEXT="mostrar menu" ID="ID_464419371"><richcontent TYPE="NOTE" CONTENT-TYPE="xml/">
<html>
  <head>
    
  </head>
  <body>
    <p>
      import edofro.tutorialomatic.ToM_actions as toma
    </p>
    <p>
      
    </p>
    <p>
      def pausa = 400
    </p>
    <p>
      
    </p>
    <p>
      def nodo = node
    </p>
    <p>
      if (!toma.hasAction(nodo)) {
    </p>
    <p>
      &nbsp;&nbsp;&nbsp;&nbsp;c.statusInfo = 'no link to menu action in selected node'
    </p>
    <p>
      &nbsp;&nbsp;&nbsp;&nbsp;return 'no link to menu action in selected node'
    </p>
    <p>
      }
    </p>
    <p>
      def accion = toma.action(nodo)
    </p>
    <p>
      
    </p>
    <p>
      toma.closeMenus(accion)
    </p>
    <p>
      
    </p>
    <p>
      toma.openMenus(accion, pausa)
    </p>
    <p>
      
    </p>
    <p>
      
    </p>
    <p>
      def espera = (toma.getMenuEntryPath(accion).size()*2)*pausa + 2000
    </p>
    <p>
      def timer = new Timer()
    </p>
    <p>
      timer.runAfter(espera){
    </p>
    <p>
      &nbsp;&nbsp;&nbsp;&nbsp;toma.closeMenus(accion)
    </p>
    <p>
      &nbsp;&nbsp;&nbsp;&nbsp;c.statusInfo = &quot; $accion : test ended&quot;
    </p>
    <p>
      }
    </p>
    <p>
      c.statusInfo = &quot; $accion : showing menu location&quot;
    </p>
  </body>
</html></richcontent>
<richcontent CONTENT-TYPE="xml/" TYPE="DETAILS">
<html>
  <head>
    
  </head>
  <body>
    <p>
      .groovy
    </p>
  </body>
</html></richcontent>
<node TEXT="ver como superar esto si botn no se encuentra disponible en ese momento" ID="ID_430233099"/>
</node>
</node>
<node TEXT="nodos para pruebas" FOLDED="true" ID="ID_1824790726">
<node TEXT="taco" FOLDED="true" ID="ID_641861336" LINK="menuitem:_IconAction.emoji-1F32E">
<node TEXT="IconAction.emoji-1F32E" ID="ID_1075260808"><richcontent TYPE="NOTE" CONTENT-TYPE="xml/">
<html>
  <head>
    
  </head>
  <body>
    In submenu <b>'Insert' &gt; 'Icons' &gt; 'Icon by category' &gt; 'Emoji collection' &gt; 'Food Drink' &gt; 'food-prepared'</b><br/>click on <b>'taco'</b>

    <p>
      
    </p>
  </body>
</html></richcontent>
</node>
<node TEXT="IconAction.emoji-1F32E" ID="ID_1217959614"><richcontent TYPE="NOTE" CONTENT-TYPE="xml/">
<html>
  <head>
    
  </head>
  <body>
    In submenu <b>'Insert'&gt;'Icons'&gt;'Icon by category'&gt;'Emoji collection'&gt;'Food Drink'&gt;'food-prepared'</b><br/>click on <b>'taco'</b>

    <p>
      
    </p>
  </body>
</html></richcontent>
<font BOLD="false"/>
</node>
<node TEXT="IconAction.emoji-1F32E" ID="ID_1295544150"><richcontent TYPE="NOTE" CONTENT-TYPE="xml/">
<html>
  <head>
    
  </head>
  <body>
    In submenu <b>'Insert'&gt;'Icons'&gt;'Icon by category'&gt;'Emoji collection'&gt;'Food Drink'&gt;'food-prepared'</b><br/>click on <b>'taco'</b>

    <p>
      
    </p>
  </body>
</html></richcontent>
</node>
<node TEXT="IconAction.emoji-1F32E" ID="ID_912517607"><richcontent TYPE="NOTE" CONTENT-TYPE="xml/">
<html>
  <head>
    
  </head>
  <body>
    In submenu <b>'Insert'&gt;'Icons'&gt;'Icon by category'&gt;'Emoji collection'&gt;'Food Drink'&gt;'food-prepared'</b><br/>click on <b>'taco'</b>

    <p>
      
    </p>
  </body>
</html></richcontent>
<font BOLD="false"/>
</node>
</node>
<node TEXT="Bold" FOLDED="true" ID="ID_351287230" LINK="menuitem:_BoldAction">
<font BOLD="true"/>
<node TEXT="BoldAction" ID="ID_1200795601"><richcontent TYPE="NOTE" CONTENT-TYPE="xml/">
<html>
  <head>
    
  </head>
  <body>
    In submenu <b>'Format' &gt; 'Node core'</b><br/>click on <b>'Bold'</b>

    <p>
      
    </p>
    You can also use de keyboard shortcut <b>'Ctrl + B'</b>&nbsp;for this command
  </body>
</html></richcontent>
</node>
<node TEXT="BoldAction" ID="ID_1398901752"><richcontent TYPE="NOTE" CONTENT-TYPE="xml/">
<html>
  <head>
    
  </head>
  <body>
    In submenu <b>'Format'&gt;'Node core'</b><br/>click on <b>'Bold'</b>

    <p>
      
    </p>
    You can also use de keyboard shortcut <b>'Ctrl + B'</b>&nbsp;for this command
  </body>
</html></richcontent>
<font BOLD="false"/>
</node>
<node TEXT="BoldAction" ID="ID_890072020"><richcontent TYPE="NOTE" CONTENT-TYPE="xml/">
<html>
  <head>
    
  </head>
  <body>
    In submenu <b>'Format'&gt;'Node core'</b><br/>click on <b>'Bold'</b>

    <p>
      
    </p>
    You can also use de keyboard shortcut <b>'Ctrl + B'</b>&nbsp;for this command
  </body>
</html></richcontent>
</node>
</node>
<node TEXT="xxxx" ID="ID_1747487252"/>
<node TEXT="Move" FOLDED="true" ID="ID_714261614" LINK="menuitem:_MoveAction">
<node TEXT="MoveAction" ID="ID_754667878"><richcontent TYPE="NOTE" CONTENT-TYPE="xml/">
<html>
  <head>
    
  </head>
  <body>
    In submenu <b>'Edit'</b><br/>click on <b>'Move'</b>

    <p>
      
    </p>
    You can also use de keyboard shortcut <b>'Ctrl + M'</b>&nbsp;for this command
  </body>
</html></richcontent>
</node>
</node>
<node TEXT="Blinking node" FOLDED="true" ID="ID_792954353" LINK="menuitem:_BlinkingNodeHookAction">
<node TEXT="BlinkingNodeHookAction" ID="ID_1839637075"><richcontent TYPE="NOTE" CONTENT-TYPE="xml/">
<html>
  <head>
    
  </head>
  <body>
    In submenu<br/><b>'Format' &gt; 'Node core'</b><br/>click on<br/><b>'Blinking node'</b>

    <p>
      
    </p>
  </body>
</html></richcontent>
<font BOLD="false"/>
</node>
<node TEXT="BlinkingNodeHookAction" ID="ID_1482021560"><richcontent TYPE="NOTE" CONTENT-TYPE="xml/">
<html>
  <head>
    
  </head>
  <body>
    In submenu <b>'Format' &gt; 'Node core'</b><br/>click on <b>'Blinking node'</b>

    <p>
      
    </p>
  </body>
</html></richcontent>
<font BOLD="false"/>
</node>
<node TEXT="BlinkingNodeHookAction" ID="ID_1911949902"><richcontent TYPE="NOTE" CONTENT-TYPE="xml/">
<html>
  <head>
    
  </head>
  <body>
    In submenu <b>'Format'&gt;'Node core'</b><br/>click on <b>'Blinking node'</b>

    <p>
      
    </p>
  </body>
</html></richcontent>
<font BOLD="false"/>
</node>
</node>
<node TEXT="launch Menu-o-Matic dialog" ID="ID_80848041" LINK="menuitem:_addons.menuOMatic.launchMenuOMaticDialog_on_single_node"/>
<node TEXT="show Markdown Helper Dialog" ID="ID_774102030" LINK="menuitem:_addons.markdownHelper.showMarkdownHelperDialog_on_single_node"/>
</node>
<node TEXT="prueba ejecutar acciones" FOLDED="true" ID="ID_1758482656">
<font BOLD="true"/>
<node TEXT="Blinking node" FOLDED="true" ID="ID_1348006132" LINK="menuitem:_BlinkingNodeHookAction">
<node TEXT="" ID="ID_1314884912"/>
</node>
<node TEXT="Strike through" ID="ID_515656690" LINK="menuitem:_StrikeThroughAction"/>
<node TEXT="Bold" ID="ID_360333904" LINK="menuitem:_BoldAction">
<font BOLD="true"/>
</node>
<node TEXT="I am happy" ID="ID_1124726584" LINK="menuitem:_IconAction.ksmiletris"/>
<node TEXT="hola" ID="ID_502074405"/>
</node>
</node>
<node TEXT="pends" ID="ID_1986977161">
<node TEXT="modificar" ID="ID_1679664642" VGAP_QUANTITY="2 px">
<node TEXT="**ToM xFuture B**" STYLE_REF="milestone" FOLDED="true" ID="ID_372498707">
<node TEXT="Manage errors (message)" STYLE_REF="pendingTask" ID="ID_141287878"><richcontent TYPE="NOTE" CONTENT-TYPE="xml/">
<html>
  <head>
    
  </head>
  <body>
    <p>
      poner try catch
    </p>
    <p>
      
    </p>
    <p>
      y que catch despliege mensaje de error
    </p>
  </body>
</html></richcontent>
<node TEXT="agregar a" ID="ID_789031946">
<node TEXT="ActionNode" STYLE_REF="maybeTask" ID="ID_1370914757"/>
<node TEXT="groovyNode" STYLE_REF="maybeTask" ID="ID_1129965019"/>
</node>
<node TEXT="catch ejecuta" ID="ID_1830953913">
<node TEXT="mensaje de error" STYLE_REF="maybeTask" ID="ID_1107375440"/>
<node TEXT="Log a log.0" STYLE_REF="maybeTask" ID="ID_12760501"/>
</node>
</node>
</node>
<node TEXT="ToM_showMenu" FOLDED="true" ID="ID_1433447117">
<attribute NAME="projectCode" VALUE="ToM_showMenu"/>
<node TEXT="**ToM xFuture A**" STYLE_REF="milestone" ID="ID_1453155829">
<node TEXT="ToM_showMenu: After a few seconds opened menus should automatically close" STYLE_REF="pendingTask" ID="ID_55129515"/>
</node>
<node TEXT="**ToM xFuture D**" STYLE_REF="milestone" ID="ID_421000096">
<node TEXT="si dos acciones seguidas coinciden en algn menu entonces no se cierra menu completamente" STYLE_REF="maybeTask" ID="ID_1993866284">
<node TEXT="cierra slo submenus diferentes" ID="ID_121261361"/>
<node TEXT="retoma desde submenu coincidente" ID="ID_1742198905"/>
<node TEXT="ejemplo" ID="ID_626194542" VGAP_QUANTITY="30.75 pt">
<node TEXT="Insert-&gt;Icons-&gt;Emoji collection-&gt;Animals &amp; Nature-&gt;animal-mammal-&gt;gorilla" ID="ID_1708170255">
<icon BUILTIN="emoji-1F98D"/>
</node>
<node TEXT="Insert-&gt;Icons-&gt;Emoji collection-&gt;Animals &amp; Nature-&gt;plant-other-&gt;palm tree" ID="ID_136458695">
<icon BUILTIN="emoji-1F334"/>
</node>
<node TEXT="Insert" ID="ID_475427718">
<node TEXT="Icons" ID="ID_785703531">
<node TEXT="Emoji collection" ID="ID_1769316628">
<node TEXT="Animals &amp; Nature" ID="ID_1661820875" VGAP_QUANTITY="41.25 pt">
<arrowlink DESTINATION="ID_868273401" STARTINCLINATION="0 pt;42.89362 pt;" ENDINCLINATION="0 pt;26.04255 pt;"/>
<node TEXT="animal-mammal" ID="ID_456541776">
<arrowlink DESTINATION="ID_1661820875" STARTINCLINATION="0 pt;0 pt;" ENDINCLINATION="0 pt;0 pt;"/>
<node TEXT="gorilla" ID="ID_1620344177">
<icon BUILTIN="emoji-1F98D"/>
<arrowlink DESTINATION="ID_456541776" STARTINCLINATION="0 pt;0 pt;" ENDINCLINATION="8.42553 pt;0 pt;"/>
</node>
</node>
<node TEXT="plant-other" ID="ID_868273401">
<arrowlink DESTINATION="ID_1994178119" STARTINCLINATION="8.42553 pt;29.10638 pt;" ENDINCLINATION="0 pt;32.17021 pt;"/>
<node TEXT="palm tree" ID="ID_1994178119">
<icon BUILTIN="emoji-1F334"/>
</node>
</node>
</node>
</node>
</node>
</node>
</node>
</node>
</node>
<node TEXT="**ToM v0.0.8**" STYLE_REF="milestone" ID="ID_4510195">
